id_no,tweet_id,tweet_created_at,tweet_text,in_reply to status_id,in_reply_to_screen_name,in_reply_to_status_id_str,in_reply_to_user_id,in_reply_to_user_id_str,favorite_count,retweet_count,source,user_location,entities,followers_count,foliowing,friends_count,follow_request_sent,user_name,user_protected,user-verified,lang,user_description,geo_enabled,user_screen_name,user_statuses_count,tweet_truncated,tweet_is_quote_status
520,1295455758461685760,2020-08-17 20:21:35,"@lilymaydavis Hey Lily! On the free plan, you'll need to wait until those posts are sent out before you can add more. As soon as one sends, it'll free up a spot in your queue to add another post :) Let me know if I can help further! -Ross",1295378349783764993,lilymaydavis,1295378349783764993,259318814,259318814,0,0,Zendesk,Worldwide,"{'hashtags': [], 'symbols': [], 'user_mentions': [{'screen_name': 'lilymaydavis', 'name': 'Lily Davis', 'id': 259318814, 'id_str': '259318814', 'indices': [0, 13]}], 'urls': []}",1005907,False,60985,False,Buffer,False,True,en,"We have 7M+ users and 75K businesses who trust us to help with social media management, visual marketing, and audience growth. Remarkable brands built here.",True,buffer,430419,False,False
521,1295418368078618624,2020-08-17 17:53:01,"""The advertiser boycott of Facebook took a toll on the social media giant, but it may have caused more damage to the company’s reputation than to its bottom line.""
https://t.co/tHbXdnpflK",None,None,None,None,None,11,5,Buffer,Worldwide,"{'hashtags': [], 'symbols': [], 'user_mentions': [], 'urls': [{'url': 'https://t.co/tHbXdnpflK', 'expanded_url': 'https://buff.ly/3goh0vK', 'display_url': 'buff.ly/3goh0vK', 'indices': [164, 187]}]}",1005907,False,60985,False,Buffer,False,True,en,"We have 7M+ users and 75K businesses who trust us to help with social media management, visual marketing, and audience growth. Remarkable brands built here.",True,buffer,430419,False,False
522,1295381778035875846,2020-08-17 15:27:37,@wesleyfenlon That sounds like a huge headache ?? I'm sorry for the roadblocks! Could you DM us the email address you use to sign into Buffer so we can take a look into this on our side? https://t.co/7POxMH7a7o -Kelly (she/her),1293597357074866178,wesleyfenlon,1293597357074866178,20607358,20607358,0,0,Zendesk,Worldwide,"{'hashtags': [], 'symbols': [], 'user_mentions': [{'screen_name': 'wesleyfenlon', 'name': 'Wes Fenlon', 'id': 20607358, 'id_str': '20607358', 'indices': [0, 13]}], 'urls': [{'url': 'https://t.co/7POxMH7a7o', 'expanded_url': 'https://twitter.com/messages/compose?recipient_id=197962366', 'display_url': 'twitter.com/messages/compo…', 'indices': [186, 209]}]}",1005907,False,60985,False,Buffer,False,True,en,"We have 7M+ users and 75K businesses who trust us to help with social media management, visual marketing, and audience growth. Remarkable brands built here.",True,buffer,430419,False,False
523,1295291855131770880,2020-08-17 09:30:18,"@khaled Thanks, Khaled. You would be able to submit any feature/plan requests over here: https://t.co/zejWC5yNz1 - Danny",1294326337419841536,khaled,1294326337419841536,639673,639673,0,0,Zendesk,Worldwide,"{'hashtags': [], 'symbols': [], 'user_mentions': [{'screen_name': 'khaled', 'name': 'Khaled', 'id': 639673, 'id_str': '639673', 'indices': [0, 7]}], 'urls': [{'url': 'https://t.co/zejWC5yNz1', 'expanded_url': 'https://buffer.com/feature-request', 'display_url': 'buffer.com/feature-request', 'indices': [89, 112]}]}",1005907,False,60985,False,Buffer,False,True,en,"We have 7M+ users and 75K businesses who trust us to help with social media management, visual marketing, and audience growth. Remarkable brands built here.",True,buffer,430419,False,False
524,1295287668306259968,2020-08-17 09:13:40,"@ajfeuerman Thanks, AJ, I've just sent over a reply to your DM with some instructions to follow in order to get your other pages connected to Buffer ?? Let us know if there's anything else on this we can help with - Danny",1294747742435041280,ajfeuerman,1294747742435041280,6798762,6798762,1,0,Zendesk,Worldwide,"{'hashtags': [], 'symbols': [], 'user_mentions': [{'screen_name': 'ajfeuerman', 'name': '(((AJ Feuerman)))', 'id': 6798762, 'id_str': '6798762', 'indices': [0, 11]}], 'urls': []}",1005907,False,60985,False,Buffer,False,True,en,"We have 7M+ users and 75K businesses who trust us to help with social media management, visual marketing, and audience growth. Remarkable brands built here.",True,buffer,430419,False,False
525,1295219089921769472,2020-08-17 04:41:09,"@itskeithbacon Hi Keith! I’m so sorry about the trouble here. I'd be happy to help out. As soon as you get the chance, could you share your email address? From there, I can take a deeper look into this! - Essence",None,None,None,None,None,0,0,Zendesk,Worldwide,"{'hashtags': [], 'symbols': [], 'user_mentions': [], 'urls': []}",1005907,False,60985,False,Buffer,False,True,en,"We have 7M+ users and 75K businesses who trust us to help with social media management, visual marketing, and audience growth. Remarkable brands built here.",True,buffer,430419,False,False
526,1295195398408146944,2020-08-17 03:07:01,"""Creating a sweet spot between what we want to say and what our audience wants to hear is tough - when those two things are the same, we’ve struck gold."" 

- Tim Urch, Social Media Manager @gethuel",None,None,None,None,None,22,5,Buffer,Worldwide,"{'hashtags': [], 'symbols': [], 'user_mentions': [{'screen_name': 'gethuel', 'name': 'Huel', 'id': 2794327217, 'id_str': '2794327217', 'indices': [189, 197]}], 'urls': []}",1005907,False,60985,False,Buffer,False,True,en,"We have 7M+ users and 75K businesses who trust us to help with social media management, visual marketing, and audience growth. Remarkable brands built here.",True,buffer,430419,False,False
527,1295195398408146944,2020-08-17 03:07:01,"""Creating a sweet spot between what we want to say and what our audience wants to hear is tough - when those two things are the same, we’ve struck gold."" 

- Tim Urch, Social Media Manager @gethuel",None,None,None,None,None,22,5,Buffer,Worldwide,"{'hashtags': [], 'symbols': [], 'user_mentions': [{'screen_name': 'gethuel', 'name': 'Huel', 'id': 2794327217, 'id_str': '2794327217', 'indices': [189, 197]}], 'urls': []}",1005907,False,60985,False,Buffer,False,True,en,"We have 7M+ users and 75K businesses who trust us to help with social media management, visual marketing, and audience growth. Remarkable brands built here.",True,buffer,430419,False,False
528,1295162780115509248,2020-08-17 00:57:24,"@ajfeuerman Hey AJ, that's no good, would you mind sending us a direct message with your email address so we can dig in further? https://t.co/7POxMH7a7o -James",1294747742435041280,ajfeuerman,1294747742435041280,6798762,6798762,0,0,Zendesk,Worldwide,"{'hashtags': [], 'symbols': [], 'user_mentions': [{'screen_name': 'ajfeuerman', 'name': '(((AJ Feuerman)))', 'id': 6798762, 'id_str': '6798762', 'indices': [0, 11]}], 'urls': [{'url': 'https://t.co/7POxMH7a7o', 'expanded_url': 'https://twitter.com/messages/compose?recipient_id=197962366', 'display_url': 'twitter.com/messages/compo…', 'indices': [129, 152]}]}",1005907,False,60985,False,Buffer,False,True,en,"We have 7M+ users and 75K businesses who trust us to help with social media management, visual marketing, and audience growth. Remarkable brands built here.",True,buffer,430419,False,False
529,1295160201742635008,2020-08-17 00:47:09,"@BobB1953 Hrmm that doesn't sound good Bob, would you mind sending us a direct message with your email address so we can dig in further? https://t.co/7POxMH7a7o -James",1294632941189050369,BobB1953,1294632941189050369,1286752613543927811,1286752613543927811,0,0,Zendesk,Worldwide,"{'hashtags': [], 'symbols': [], 'user_mentions': [{'screen_name': 'BobB1953', 'name': 'Bob Barry, CFP®', 'id': 1286752613543927811, 'id_str': '1286752613543927811', 'indices': [0, 9]}], 'urls': [{'url': 'https://t.co/7POxMH7a7o', 'expanded_url': 'https://twitter.com/messages/compose?recipient_id=197962366', 'display_url': 'twitter.com/messages/compo…', 'indices': [137, 160]}]}",1005907,False,60985,False,Buffer,False,True,en,"We have 7M+ users and 75K businesses who trust us to help with social media management, visual marketing, and audience growth. Remarkable brands built here.",True,buffer,430419,False,False
530,1295159948108804096,2020-08-17 00:46:09,"@AbovetheFoldCA That's an interesting one, mind if we dig in further? Would you send us a direct message with your email address so we can dig in further? https://t.co/7POxMH7a7o - James",1294315541318885376,UGotThs,1294315541318885376,733090875148894208,733090875148894208,1,0,Zendesk,Worldwide,"{'hashtags': [], 'symbols': [], 'user_mentions': [], 'urls': [{'url': 'https://t.co/7POxMH7a7o', 'expanded_url': 'https://twitter.com/messages/compose?recipient_id=197962366', 'display_url': 'twitter.com/messages/compo…', 'indices': [155, 178]}]}",1005907,False,60985,False,Buffer,False,True,en,"We have 7M+ users and 75K businesses who trust us to help with social media management, visual marketing, and audience growth. Remarkable brands built here.",True,buffer,430419,False,False
531,1295157001614499844,2020-08-17 00:34:26,"@neeraj Oh! Thanks for sharing Neeraj, I'll pass this along to the team ?? -James",1294521368239919104,neeraj,1294521368239919104,6427012,6427012,1,0,Zendesk,Worldwide,"{'hashtags': [], 'symbols': [], 'user_mentions': [{'screen_name': 'neeraj', 'name': 'Neeraj', 'id': 6427012, 'id_str': '6427012', 'indices': [0, 7]}], 'urls': []}",1005907,False,60985,False,Buffer,False,True,en,"We have 7M+ users and 75K businesses who trust us to help with social media management, visual marketing, and audience growth. Remarkable brands built here.",True,buffer,430419,False,False
532,1295156469952897028,2020-08-17 00:32:19,@stackrole @svpino https://t.co/NbMopomaTF ?? -James,1294437591496790016,Stackrole,1294437591496790016,1257609181609091073,1257609181609091073,2,0,Zendesk,Worldwide,"{'hashtags': [], 'symbols': [], 'user_mentions': [{'screen_name': 'Stackrole', 'name': 'Stackrole', 'id': 1257609181609091073, 'id_str': '1257609181609091073', 'indices': [0, 10]}, {'screen_name': 'svpino', 'name': 'Santiago', 'id': 18737039, 'id_str': '18737039', 'indices': [11, 18]}], 'urls': [{'url': 'https://t.co/NbMopomaTF', 'expanded_url': 'https://buffer.com/salary', 'display_url': 'buffer.com/salary', 'indices': [19, 42]}]}",1005907,False,60985,False,Buffer,False,True,en,"We have 7M+ users and 75K businesses who trust us to help with social media management, visual marketing, and audience growth. Remarkable brands built here.",True,buffer,430419,False,False
533,1295154730277179392,2020-08-17 00:25:25,@ffaargl There sure is! Just start a trial of any of our plans over here: https://t.co/sOmBYP0DCz and once your trial expires you'll be dropped down to our free plan :) -James,1294351139039739911,ffaargl,1294351139039739911,283162128,283162128,0,0,Zendesk,Worldwide,"{'hashtags': [], 'symbols': [], 'user_mentions': [{'screen_name': 'ffaargl', 'name': 'Luca', 'id': 283162128, 'id_str': '283162128', 'indices': [0, 8]}], 'urls': [{'url': 'https://t.co/sOmBYP0DCz', 'expanded_url': 'https://buffer.com/pricing/publish', 'display_url': 'buffer.com/pricing/publish', 'indices': [74, 97]}]}",1005907,False,60985,False,Buffer,False,True,en,"We have 7M+ users and 75K businesses who trust us to help with social media management, visual marketing, and audience growth. Remarkable brands built here.",True,buffer,430419,False,False
534,1295154151790448641,2020-08-17 00:23:07,"@khaled Thanks for the ideas Khaled, I'd love to hear more about your thoughts on a plan without Instagram or Pinterest if you're up for it. - James",1294326337419841536,khaled,1294326337419841536,639673,639673,0,0,Zendesk,Worldwide,"{'hashtags': [], 'symbols': [], 'user_mentions': [{'screen_name': 'khaled', 'name': 'Khaled', 'id': 639673, 'id_str': '639673', 'indices': [0, 7]}], 'urls': []}",1005907,False,60985,False,Buffer,False,True,en,"We have 7M+ users and 75K businesses who trust us to help with social media management, visual marketing, and audience growth. Remarkable brands built here.",True,buffer,430419,False,False
535,1295153411835469824,2020-08-17 00:20:10,"@inspirEnrich Sure thing! To give the best support we'll need to take a look at your account, would you send us a direct message with your email address so we can dig in further? https://t.co/7POxMH7a7o - James",1294321514012184581,inspirEnrich,1294321514012184581,721368332801286145,721368332801286145,0,0,Zendesk,Worldwide,"{'hashtags': [], 'symbols': [], 'user_mentions': [{'screen_name': 'inspirEnrich', 'name': 'inspirEnrich', 'id': 721368332801286145, 'id_str': '721368332801286145', 'indices': [0, 13]}], 'urls': [{'url': 'https://t.co/7POxMH7a7o', 'expanded_url': 'https://twitter.com/messages/compose?recipient_id=197962366', 'display_url': 'twitter.com/messages/compo…', 'indices': [179, 202]}]}",1005907,False,60985,False,Buffer,False,True,en,"We have 7M+ users and 75K businesses who trust us to help with social media management, visual marketing, and audience growth. Remarkable brands built here.",True,buffer,430419,False,False
536,1295153020263596034,2020-08-17 00:18:37,@glosinfo Hi! So sorry for the problems you're having. You can either DM us here on Twitter or submit a ticket over here: https://t.co/kHxZ5XrAC9 - James,1294293105886322688,glosinfo,1294293105886322688,90143129,90143129,0,0,Zendesk,Worldwide,"{'hashtags': [], 'symbols': [], 'user_mentions': [{'screen_name': 'glosinfo', 'name': 'www.glos.info - Gloucestershire', 'id': 90143129, 'id_str': '90143129', 'indices': [0, 9]}], 'urls': [{'url': 'https://t.co/kHxZ5XrAC9', 'expanded_url': 'https://support.buffer.com/hc/en-us/requests/new', 'display_url': 'support.buffer.com/hc/en-us/reque…', 'indices': [122, 145]}]}",1005907,False,60985,False,Buffer,False,True,en,"We have 7M+ users and 75K businesses who trust us to help with social media management, visual marketing, and audience growth. Remarkable brands built here.",True,buffer,430419,False,False
537,1295152551336312833,2020-08-17 00:16:45,"@MetroQuimica Hey! If you click on ""manage social accounts"", then on the next page click on ""add new social account"" you should be able to select ""LinkedIn Page"" from the list ?? Let me know if you need anything else! -James",1294205102090334208,MetroQuimica,1294205102090334208,184648535,184648535,0,0,Zendesk,Worldwide,"{'hashtags': [], 'symbols': [], 'user_mentions': [{'screen_name': 'MetroQuimica', 'name': 'MetroQuimica.Net', 'id': 184648535, 'id_str': '184648535', 'indices': [0, 13]}], 'urls': []}",1005907,False,60985,False,Buffer,False,True,en,"We have 7M+ users and 75K businesses who trust us to help with social media management, visual marketing, and audience growth. Remarkable brands built here.",True,buffer,430419,False,False
538,1295150562846167042,2020-08-17 00:08:51,"@drnic1 @davidnunez We're currently aware of our browser extension being stuck on ""open in a new tab"" even if you have ""overlay"" selected. The team are looking into it but right now that's all the information I have. If you have further questions please feel free to DM us. -James",1294007474719264776,drnic1,1294007474719264776,14681336,14681336,1,0,Zendesk,Worldwide,"{'hashtags': [], 'symbols': [], 'user_mentions': [{'screen_name': 'drnic1', 'name': 'Ñick van Terheyden, MD - ""Dr Ñiçk""', 'id': 14681336, 'id_str': '14681336', 'indices': [0, 7]}, {'screen_name': 'davidnunez', 'name': 'David Nuñez', 'id': 763489, 'id_str': '763489', 'indices': [8, 19]}], 'urls': []}",1005907,False,60985,False,Buffer,False,True,en,"We have 7M+ users and 75K businesses who trust us to help with social media management, visual marketing, and audience growth. Remarkable brands built here.",True,buffer,430419,False,False
539,1295149132508798976,2020-08-17 00:03:10,@FrenchMajesty Thanks Verdi! So glad we could help out ?? -James,1294111001328197634,FrenchMajesty,1294111001328197634,726950443,726950443,1,0,Zendesk,Worldwide,"{'hashtags': [], 'symbols': [], 'user_mentions': [{'screen_name': 'FrenchMajesty', 'name': 'Verdi Kapuku', 'id': 726950443, 'id_str': '726950443', 'indices': [0, 14]}], 'urls': []}",1005907,False,60985,False,Buffer,False,True,en,"We have 7M+ users and 75K businesses who trust us to help with social media management, visual marketing, and audience growth. Remarkable brands built here.",True,buffer,430419,False,False
540,1295145188676050945,2020-08-16 23:47:30,"@DavidBoles Hey David, I can see that Daniel has escalated your ticket, the team will get back to you as soon as they can.  In the meantime, if there's anything else I can help with please don't hesitate to get back to me. -James",1293899172500865024,DavidBoles,1293899172500865024,122481454,122481454,0,0,Zendesk,Worldwide,"{'hashtags': [], 'symbols': [], 'user_mentions': [{'screen_name': 'DavidBoles', 'name': 'David Boles', 'id': 122481454, 'id_str': '122481454', 'indices': [0, 11]}], 'urls': []}",1005907,False,60985,False,Buffer,False,True,en,"We have 7M+ users and 75K businesses who trust us to help with social media management, visual marketing, and audience growth. Remarkable brands built here.",True,buffer,430419,False,False
541,1295113285755441153,2020-08-16 21:40:44,"@AaronJosephHall  In the pop-up box, you can scroll down to ensure that your corresponding Facebook page is checked for permissions. I'll be on standby in the meantime! - Essence",1294648211173507072,AaronJosephHall,1294648211173507072,50029325,50029325,0,0,Zendesk,Worldwide,"{'hashtags': [], 'symbols': [], 'user_mentions': [{'screen_name': 'AaronJosephHall', 'name': 'Aaron Hall', 'id': 50029325, 'id_str': '50029325', 'indices': [0, 16]}], 'urls': []}",1005907,False,60985,False,Buffer,False,True,en,"We have 7M+ users and 75K businesses who trust us to help with social media management, visual marketing, and audience growth. Remarkable brands built here.",True,buffer,430419,False,False
542,1295112564188295175,2020-08-16 21:37:51,"@AaronJosephHall I’m so sorry about the trouble we've caused here, Aaron! When you have the chance, could you navigate to your Business Integration settings from a computer (https://t.co/qW8tHgbTEk), go to Buffer and click ""View and Edit""? - Essence",1294648211173507072,AaronJosephHall,1294648211173507072,50029325,50029325,0,0,Zendesk,Worldwide,"{'hashtags': [], 'symbols': [], 'user_mentions': [{'screen_name': 'AaronJosephHall', 'name': 'Aaron Hall', 'id': 50029325, 'id_str': '50029325', 'indices': [0, 16]}], 'urls': [{'url': 'https://t.co/qW8tHgbTEk', 'expanded_url': 'https://www.facebook.com/settings?tab=business_tools', 'display_url': 'facebook.com/settings?tab=b…', 'indices': [174, 197]}]}",1005907,False,60985,False,Buffer,False,True,en,"We have 7M+ users and 75K businesses who trust us to help with social media management, visual marketing, and audience growth. Remarkable brands built here.",True,buffer,430419,False,False
543,1295112076692774912,2020-08-16 21:35:55,"@OhLyseDoIt Hello ?? Is there anything we can lend a hand with? If so, could you share the email address you use to sign into Buffer and a bit more information about the issue you're seeing or the question you have so we can dig in? - Essence",None,OhLyseDoIt,None,153159914,153159914,0,0,Zendesk,Worldwide,"{'hashtags': [], 'symbols': [], 'user_mentions': [{'screen_name': 'OhLyseDoIt', 'name': 'B*tchKnowLyse', 'id': 153159914, 'id_str': '153159914', 'indices': [0, 11]}], 'urls': []}",1005907,False,60985,False,Buffer,False,True,en,"We have 7M+ users and 75K businesses who trust us to help with social media management, visual marketing, and audience growth. Remarkable brands built here.",True,buffer,430419,False,False
544,1294970664735117314,2020-08-16 12:14:00,Here are TikTok's seven highest-earning stars and their success stories ?? https://t.co/Eswh3yNTd9,None,None,None,None,None,13,2,Buffer,Worldwide,"{'hashtags': [], 'symbols': [], 'user_mentions': [], 'urls': [{'url': 'https://t.co/Eswh3yNTd9', 'expanded_url': 'https://buff.ly/3gQtPzk', 'display_url': 'buff.ly/3gQtPzk', 'indices': [75, 98]}]}",1005907,False,60985,False,Buffer,False,True,en,"We have 7M+ users and 75K businesses who trust us to help with social media management, visual marketing, and audience growth. Remarkable brands built here.",True,buffer,430419,False,False
545,1294608280694792193,2020-08-15 12:14:01,"What we're reading today ??:

Twitter is surveying users on what types of features they’d be interested in getting from a premium subscription. Some features that are being considered are undo send, special badges for profiles, and advanced analytics.

https://t.co/BwNWil8R2U",None,None,None,None,None,21,8,Buffer,Worldwide,"{'hashtags': [], 'symbols': [], 'user_mentions': [], 'urls': [{'url': 'https://t.co/BwNWil8R2U', 'expanded_url': 'https://buff.ly/3hYRM7G', 'display_url': 'buff.ly/3hYRM7G', 'indices': [252, 275]}]}",1005907,False,60985,False,Buffer,False,True,en,"We have 7M+ users and 75K businesses who trust us to help with social media management, visual marketing, and audience growth. Remarkable brands built here.",True,buffer,430419,False,False
546,1294438699317460992,2020-08-15 01:00:10,@unclechi_ Good one! Our integration with Instagram works a bit differently than the other networks. We require some extra permissions &amp; setup to be able to post on your behalf. This guide goes deeper into how it works:  Scheduling Instagram posts: https://t.co/CJntecGmj3? -Julia,1293953263541379072,unclechi_,1293953263541379072,407739994,407739994,0,0,Zendesk,Worldwide,"{'hashtags': [], 'symbols': [], 'user_mentions': [{'screen_name': 'unclechi_', 'name': 'Chi’s Quick Fix', 'id': 407739994, 'id_str': '407739994', 'indices': [0, 10]}], 'urls': [{'url': 'https://t.co/CJntecGmj3', 'expanded_url': 'https://support.buffer.com/hc/en-us/articles/360037886294', 'display_url': 'support.buffer.com/hc/en-us/artic…', 'indices': [253, 276]}]}",1005907,False,60985,False,Buffer,False,True,en,"We have 7M+ users and 75K businesses who trust us to help with social media management, visual marketing, and audience growth. Remarkable brands built here.",True,buffer,430419,False,False
547,1294438699317460992,2020-08-15 01:00:10,@unclechi_ Good one! Our integration with Instagram works a bit differently than the other networks. We require some extra permissions &amp; setup to be able to post on your behalf. This guide goes deeper into how it works:  Scheduling Instagram posts: https://t.co/CJntecGmj3? -Julia,1293953263541379072,unclechi_,1293953263541379072,407739994,407739994,0,0,Zendesk,Worldwide,"{'hashtags': [], 'symbols': [], 'user_mentions': [{'screen_name': 'unclechi_', 'name': 'Chi’s Quick Fix', 'id': 407739994, 'id_str': '407739994', 'indices': [0, 10]}], 'urls': [{'url': 'https://t.co/CJntecGmj3', 'expanded_url': 'https://support.buffer.com/hc/en-us/articles/360037886294', 'display_url': 'support.buffer.com/hc/en-us/artic…', 'indices': [253, 276]}]}",1005907,False,60985,False,Buffer,False,True,en,"We have 7M+ users and 75K businesses who trust us to help with social media management, visual marketing, and audience growth. Remarkable brands built here.",True,buffer,430419,False,False
548,1294438265030926337,2020-08-15 00:58:26,"@GrandioseDays Ah, oh no! I'm so sorry to hear things haven't been working smoothly. Mind sharing a bit more about what you've been encountering? I'd love to see if we can help. -Julia",1293947621845983234,GrandioseDays,1293947621845983234,2874412936,2874412936,0,0,Zendesk,Worldwide,"{'hashtags': [], 'symbols': [], 'user_mentions': [{'screen_name': 'GrandioseDays', 'name': 'Tasmin ??', 'id': 2874412936, 'id_str': '2874412936', 'indices': [0, 14]}], 'urls': []}",1005907,False,60985,False,Buffer,False,True,en,"We have 7M+ users and 75K businesses who trust us to help with social media management, visual marketing, and audience growth. Remarkable brands built here.",True,buffer,430419,False,False
549,1294436353028096004,2020-08-15 00:50:50,"@KwameSpeaks Yikes, that definitely doesn't sound great. Sorry for the issues, Kwame. Could you share a bit more info about what you're running into? -Julia",1293938148234260482,KwameSpeaks,1293938148234260482,243027359,243027359,0,0,Zendesk,Worldwide,"{'hashtags': [], 'symbols': [], 'user_mentions': [{'screen_name': 'KwameSpeaks', 'name': 'Kwame Speaks', 'id': 243027359, 'id_str': '243027359', 'indices': [0, 12]}], 'urls': []}",1005907,False,60985,False,Buffer,False,True,en,"We have 7M+ users and 75K businesses who trust us to help with social media management, visual marketing, and audience growth. Remarkable brands built here.",True,buffer,430419,False,False
550,1294395409402454016,2020-08-14 22:08:08,"@therealtblake Sorry for the troubles! We've seen that this changed recently, though we haven't made updates on our side. It's likely due to a change from Chrome. We're digging in &amp; I'll add your report to the case that we have to going so we can circle back if it changes. -Julia",1293905296075755520,therealtblake,1293905296075755520,249655148,249655148,0,0,Zendesk,Worldwide,"{'hashtags': [], 'symbols': [], 'user_mentions': [{'screen_name': 'therealtblake', 'name': 'TBlake', 'id': 249655148, 'id_str': '249655148', 'indices': [0, 14]}], 'urls': []}",1005907,False,60985,False,Buffer,False,True,en,"We have 7M+ users and 75K businesses who trust us to help with social media management, visual marketing, and audience growth. Remarkable brands built here.",True,buffer,430419,False,False
