id_no,tweet_id,tweet_created_at,tweet_text,in_reply to status_id,in_reply_to_screen_name,in_reply_to_status_id_str,in_reply_to_user_id,in_reply_to_user_id_str,favorite_count,retweet_count,source,user_location,entities,followers_count,foliowing,friends_count,follow_request_sent,user_name,user_protected,user-verified,lang,user_description,geo_enabled,user_screen_name,user_statuses_count,tweet_truncated,tweet_is_quote_status
245,1303801580991414272,2020-09-09 21:04:55,@ChineseAdoptPod I'm glad that was helpful! We're here in case anything else comes up :) -Kelly (she/her),1301949013458128897,ChineseAdoptPod,1301949013458128897,1293979074059214854,1293979074059214854,0,0,Zendesk,Worldwide,"{'hashtags': [], 'symbols': [], 'user_mentions': [{'screen_name': 'ChineseAdoptPod', 'name': 'Adopted Babies from China Podcast - Host Tara', 'id': 1293979074059214854, 'id_str': '1293979074059214854', 'indices': [0, 16]}], 'urls': []}",1005907,False,60985,False,Buffer,False,True,en,"We have 7M+ users and 75K businesses who trust us to help with social media management, visual marketing, and audience growth. Remarkable brands built here.",True,buffer,430419,False,False
246,1303786691396866054,2020-09-09 20:05:45,"@taiwanreporter Hey Klaus! Thanks for letting us know about this. We've heard similar feedback from other Buffer customers, and make sure to flag up these feature requests for the team as we work to improve the dashboard experience. You're not alone in wanting some of those fu...",1302155024198320130,taiwanreporter,1302155024198320130,99930114,99930114,1,0,Zendesk,Worldwide,"{'hashtags': [], 'symbols': [], 'user_mentions': [{'screen_name': 'taiwanreporter', 'name': 'Klaus Bardenhagen', 'id': 99930114, 'id_str': '99930114', 'indices': [0, 15]}], 'urls': []}",1005907,False,60985,False,Buffer,False,True,en,"We have 7M+ users and 75K businesses who trust us to help with social media management, visual marketing, and audience growth. Remarkable brands built here.",True,buffer,430419,False,False
247,1303786691396866054,2020-09-09 20:05:45,"@taiwanreporter Hey Klaus! Thanks for letting us know about this. We've heard similar feedback from other Buffer customers, and make sure to flag up these feature requests for the team as we work to improve the dashboard experience. You're not alone in wanting some of those fu...",1302155024198320130,taiwanreporter,1302155024198320130,99930114,99930114,1,0,Zendesk,Worldwide,"{'hashtags': [], 'symbols': [], 'user_mentions': [{'screen_name': 'taiwanreporter', 'name': 'Klaus Bardenhagen', 'id': 99930114, 'id_str': '99930114', 'indices': [0, 15]}], 'urls': []}",1005907,False,60985,False,Buffer,False,True,en,"We have 7M+ users and 75K businesses who trust us to help with social media management, visual marketing, and audience growth. Remarkable brands built here.",True,buffer,430419,False,False
248,1303766221582733313,2020-09-09 18:44:24,"@BrideOfLinux Hey Christine ?? So sorry you had to switch browsers there! If you're up for sharing more about the trouble you were seeing, we'd love to lend a hand! Absolutely no pressure though. -Karinna",1302008806914895875,BrideOfLinux,1302008806914895875,4455481185,4455481185,0,0,Zendesk,Worldwide,"{'hashtags': [], 'symbols': [], 'user_mentions': [{'screen_name': 'BrideOfLinux', 'name': 'Christine Hall', 'id': 4455481185, 'id_str': '4455481185', 'indices': [0, 13]}], 'urls': []}",1005907,False,60985,False,Buffer,False,True,en,"We have 7M+ users and 75K businesses who trust us to help with social media management, visual marketing, and audience growth. Remarkable brands built here.",True,buffer,430419,False,False
249,1303756724395036672,2020-09-09 18:06:40,"@supposeiam Hi Vivienne, I'm sorry about the billing headache! Could you DM us the email address on the Buffer account so we can dig in here and get this sorted out completely? -Kelly (she/her) https://t.co/7POxMH7a7o",1302862420059320322,supposeiam,1302862420059320322,83799572,83799572,0,0,Zendesk,Worldwide,"{'hashtags': [], 'symbols': [], 'user_mentions': [{'screen_name': 'supposeiam', 'name': 'vivienne k neale', 'id': 83799572, 'id_str': '83799572', 'indices': [0, 11]}], 'urls': [{'url': 'https://t.co/7POxMH7a7o', 'expanded_url': 'https://twitter.com/messages/compose?recipient_id=197962366', 'display_url': 'twitter.com/messages/compo…', 'indices': [194, 217]}]}",1005907,False,60985,False,Buffer,False,True,en,"We have 7M+ users and 75K businesses who trust us to help with social media management, visual marketing, and audience growth. Remarkable brands built here.",True,buffer,430419,False,False
250,1303755435321618432,2020-09-09 18:01:33,"@needynewtgaming Great one! Our Free plan lets you connect up to 3 social channels &amp; schedule up to 10 posts in each queue. If you want basic analytics or more posts, our Pro plan may be a good fit. Here's a comparison: https://t.co/iLXOkkz9ha. Happy to chat through this! -Kelly",1301993451249111042,needynewtgaming,1301993451249111042,1151159800039952385,1151159800039952385,0,0,Zendesk,Worldwide,"{'hashtags': [], 'symbols': [], 'user_mentions': [{'screen_name': 'needynewtgaming', 'name': 'needynewtgaming', 'id': 1151159800039952385, 'id_str': '1151159800039952385', 'indices': [0, 16]}], 'urls': [{'url': 'https://t.co/iLXOkkz9ha', 'expanded_url': 'https://support.buffer.com/hc/en-us/articles/360037724214-Buffer-Publish-plans-and-pricing', 'display_url': 'support.buffer.com/hc/en-us/artic…', 'indices': [224, 247]}]}",1005907,False,60985,False,Buffer,False,True,en,"We have 7M+ users and 75K businesses who trust us to help with social media management, visual marketing, and audience growth. Remarkable brands built here.",True,buffer,430419,False,False
251,1303744953936424960,2020-09-09 17:19:54,"@ChineseAdoptPod Hey there! In case it helps, with Buffer you can mention other pages/companies on Twitter, Instagram, and Facebook. We've shared more here: https://t.co/Nitg7LQdmm. Shout if we can help with any questions. -Kelly (she/her)",1301949013458128897,ChineseAdoptPod,1301949013458128897,1293979074059214854,1293979074059214854,0,0,Zendesk,Worldwide,"{'hashtags': [], 'symbols': [], 'user_mentions': [{'screen_name': 'ChineseAdoptPod', 'name': 'Adopted Babies from China Podcast - Host Tara', 'id': 1293979074059214854, 'id_str': '1293979074059214854', 'indices': [0, 16]}], 'urls': [{'url': 'https://t.co/Nitg7LQdmm', 'expanded_url': 'https://support.buffer.com/hc/en-us/articles/360038453214-Adding-mentions-tags-in-posts', 'display_url': 'support.buffer.com/hc/en-us/artic…', 'indices': [157, 180]}]}",1005907,False,60985,False,Buffer,False,True,en,"We have 7M+ users and 75K businesses who trust us to help with social media management, visual marketing, and audience growth. Remarkable brands built here.",True,buffer,430419,False,False
252,1303735333868240897,2020-09-09 16:41:40,"@dsoltesz I completely agree ?? I hope we can deliver some improvement for you soon ?? 
-Dave",1301902532600410112,dsoltesz,1301902532600410112,13989852,13989852,1,0,Zendesk,Worldwide,"{'hashtags': [], 'symbols': [], 'user_mentions': [{'screen_name': 'dsoltesz', 'name': 'Deborah Lee Soltesz', 'id': 13989852, 'id_str': '13989852', 'indices': [0, 9]}], 'urls': []}",1005907,False,60985,False,Buffer,False,True,en,"We have 7M+ users and 75K businesses who trust us to help with social media management, visual marketing, and audience growth. Remarkable brands built here.",True,buffer,430419,False,False
253,1303734987662004226,2020-09-09 16:40:17,"@JaanaNystrom Oh no! Which account were these published and which time? I checked your account and couldn't spot it 
(feel free to DM!)
-Dave",1302589203088318465,JaanaNystrom,1302589203088318465,216011343,216011343,0,0,Zendesk,Worldwide,"{'hashtags': [], 'symbols': [], 'user_mentions': [{'screen_name': 'JaanaNystrom', 'name': 'Jaana Golfer', 'id': 216011343, 'id_str': '216011343', 'indices': [0, 13]}], 'urls': []}",1005907,False,60985,False,Buffer,False,True,en,"We have 7M+ users and 75K businesses who trust us to help with social media management, visual marketing, and audience growth. Remarkable brands built here.",True,buffer,430419,False,False
254,1303733501938642944,2020-09-09 16:34:23,"@Rebeca_LL Hi Rebeca, I'm sorry, I've just replied to your DM
-Dave",1303425468742369290,Rebeca_LL,1303425468742369290,37052393,37052393,0,0,Zendesk,Worldwide,"{'hashtags': [], 'symbols': [], 'user_mentions': [{'screen_name': 'Rebeca_LL', 'name': 'Rebeca_Ll #teamRutte #VERDE ????', 'id': 37052393, 'id_str': '37052393', 'indices': [0, 10]}], 'urls': []}",1005907,False,60985,False,Buffer,False,True,en,"We have 7M+ users and 75K businesses who trust us to help with social media management, visual marketing, and audience growth. Remarkable brands built here.",True,buffer,430419,False,False
255,1303725900261924869,2020-09-09 16:04:11,"@dsoltesz Hi, sorry about the headaches we've caused. We've been hearing this feedback fairly consistently and I wanted to let you know we're reviewing this change with our team, though don't have any ETA on an update I'm afraid
-Dave",1301902532600410112,dsoltesz,1301902532600410112,13989852,13989852,1,0,Zendesk,Worldwide,"{'hashtags': [], 'symbols': [], 'user_mentions': [{'screen_name': 'dsoltesz', 'name': 'Deborah Lee Soltesz', 'id': 13989852, 'id_str': '13989852', 'indices': [0, 9]}], 'urls': []}",1005907,False,60985,False,Buffer,False,True,en,"We have 7M+ users and 75K businesses who trust us to help with social media management, visual marketing, and audience growth. Remarkable brands built here.",True,buffer,430419,False,False
256,1303722737811296259,2020-09-09 15:51:37,"@EECallum Yikes, sorry about the CPU usage, Callum! Could you DM us the email address you use to sign into Buffer so we can flag this up for our team to look at? -Kelly (she/her) https://t.co/7POxMH7a7o",1301905085677658114,EECallum,1301905085677658114,34310649,34310649,0,0,Zendesk,Worldwide,"{'hashtags': [], 'symbols': [], 'user_mentions': [{'screen_name': 'EECallum', 'name': 'Callum Main', 'id': 34310649, 'id_str': '34310649', 'indices': [0, 9]}], 'urls': [{'url': 'https://t.co/7POxMH7a7o', 'expanded_url': 'https://twitter.com/messages/compose?recipient_id=197962366', 'display_url': 'twitter.com/messages/compo…', 'indices': [179, 202]}]}",1005907,False,60985,False,Buffer,False,True,en,"We have 7M+ users and 75K businesses who trust us to help with social media management, visual marketing, and audience growth. Remarkable brands built here.",True,buffer,430419,False,False
257,1303698923228401666,2020-09-09 14:16:59,"@NatalieJayW_ Thanks, Natalia. If you run into any issues, please can you DM us with some screenshots of the problems you're hitting? - Danny",1303617151140536321,NatalieJayW_,1303617151140536321,500786005,500786005,0,0,Zendesk,Worldwide,"{'hashtags': [], 'symbols': [], 'user_mentions': [{'screen_name': 'NatalieJayW_', 'name': 'Natalie | The Typeface Group', 'id': 500786005, 'id_str': '500786005', 'indices': [0, 13]}], 'urls': []}",1005907,False,60985,False,Buffer,False,True,en,"We have 7M+ users and 75K businesses who trust us to help with social media management, visual marketing, and audience growth. Remarkable brands built here.",True,buffer,430419,False,False
258,1303697615725490176,2020-09-09 14:11:47,"@NiklasRoseMusic If you activate the option for direct publishing, it won't be removed. If you'd like to DM your email address I can check your account to make sure!
-Dave",1301899578841739266,NiklasRoseMusic,1301899578841739266,1125800556260466691,1125800556260466691,0,0,Zendesk,Worldwide,"{'hashtags': [], 'symbols': [], 'user_mentions': [{'screen_name': 'NiklasRoseMusic', 'name': 'Niklas Rose', 'id': 1125800556260466691, 'id_str': '1125800556260466691', 'indices': [0, 16]}], 'urls': []}",1005907,False,60985,False,Buffer,False,True,en,"We have 7M+ users and 75K businesses who trust us to help with social media management, visual marketing, and audience growth. Remarkable brands built here.",True,buffer,430419,False,False
259,1303686386151817217,2020-09-09 13:27:10,"@NiklasRoseMusic Hey Niklas! Unfortunately, Instagram's API has only been set up for Instagram business accounts. Hopefully, they'll open this up soon. Please let me know if you have any questions at all, on this or anything else
-Dave",1301899578841739266,NiklasRoseMusic,1301899578841739266,1125800556260466691,1125800556260466691,0,0,Zendesk,Worldwide,"{'hashtags': [], 'symbols': [], 'user_mentions': [{'screen_name': 'NiklasRoseMusic', 'name': 'Niklas Rose', 'id': 1125800556260466691, 'id_str': '1125800556260466691', 'indices': [0, 16]}], 'urls': []}",1005907,False,60985,False,Buffer,False,True,en,"We have 7M+ users and 75K businesses who trust us to help with social media management, visual marketing, and audience growth. Remarkable brands built here.",True,buffer,430419,False,False
260,1303672657632690176,2020-09-09 12:32:37,"@NatalieJayW_ Hi Natalie, sorry for the trouble here. If you click into 'Manage Social Accounts' &gt; select your Instagram account &gt; 'Reconnect' and go through the Facebook authentication prompts there, we should be able to get things set up with direct scheduling for you! - Danny",1303617151140536321,NatalieJayW_,1303617151140536321,500786005,500786005,0,0,Zendesk,Worldwide,"{'hashtags': [], 'symbols': [], 'user_mentions': [{'screen_name': 'NatalieJayW_', 'name': 'Natalie | The Typeface Group', 'id': 500786005, 'id_str': '500786005', 'indices': [0, 13]}], 'urls': []}",1005907,False,60985,False,Buffer,False,True,en,"We have 7M+ users and 75K businesses who trust us to help with social media management, visual marketing, and audience growth. Remarkable brands built here.",True,buffer,430419,False,False
261,1303592477069389824,2020-09-09 07:14:00,"We'd recommend bookmarking this link that contains a Google sheet of the most iconic ads of all time. ????

Which one's your favorite? Reply with your thoughts! 
 https://t.co/b3b5smvKzm",None,None,None,None,None,33,6,Buffer,Worldwide,"{'hashtags': [], 'symbols': [], 'user_mentions': [], 'urls': [{'url': 'https://t.co/b3b5smvKzm', 'expanded_url': 'https://buff.ly/3hPsDwq', 'display_url': 'buff.ly/3hPsDwq', 'indices': [161, 184]}]}",1005907,False,60985,False,Buffer,False,True,en,"We have 7M+ users and 75K businesses who trust us to help with social media management, visual marketing, and audience growth. Remarkable brands built here.",True,buffer,430419,False,False
262,1303530319639916544,2020-09-09 03:07:01,What factors are influencing Gen Z'ers purchasing decisions? Seven Gen Z marketers and entrepreneurs share their insights from the frontlines. ?? https://t.co/GmzixY2TW1,None,None,None,None,None,10,3,Buffer,Worldwide,"{'hashtags': [], 'symbols': [], 'user_mentions': [], 'urls': [{'url': 'https://t.co/GmzixY2TW1', 'expanded_url': 'https://buff.ly/3jwqO8d', 'display_url': 'buff.ly/3jwqO8d', 'indices': [146, 169]}]}",1005907,False,60985,False,Buffer,False,True,en,"We have 7M+ users and 75K businesses who trust us to help with social media management, visual marketing, and audience growth. Remarkable brands built here.",True,buffer,430419,False,False
263,1303463435284426753,2020-09-08 22:41:14,"@_laurencurrie_ Oh no! That stinks, Lauren. Really sorry about that! Any chance you can DM us a video of your steps right before things crash? We'd love to get to the bottom of this! -Karinna",1302323217802104832,_laurencurrie_,1302323217802104832,18358227,18358227,0,0,Zendesk,Worldwide,"{'hashtags': [], 'symbols': [], 'user_mentions': [{'screen_name': '_laurencurrie_', 'name': 'Lauren Currie OBE', 'id': 18358227, 'id_str': '18358227', 'indices': [0, 15]}], 'urls': []}",1005907,False,60985,False,Buffer,False,True,en,"We have 7M+ users and 75K businesses who trust us to help with social media management, visual marketing, and audience growth. Remarkable brands built here.",True,buffer,430419,False,False
264,1303428223360012291,2020-09-08 20:21:19,"@recgnizeurtruth Hey Lisa ?? Truly sorry about the long wait over the holiday weekend. I think my teammate replied to your email on Friday. Did that reach you Ok? If you're still seeing issue, just let us know! -Karinna",None,None,None,None,None,0,0,Zendesk,Worldwide,"{'hashtags': [], 'symbols': [], 'user_mentions': [], 'urls': []}",1005907,False,60985,False,Buffer,False,True,en,"We have 7M+ users and 75K businesses who trust us to help with social media management, visual marketing, and audience growth. Remarkable brands built here.",True,buffer,430419,False,False
265,1303419584045817863,2020-09-08 19:46:59,"@JoshMPacheco No worries, Joshua! What error messages do you run into when you try to log in to Facebook during the connection process? - Essence",1303377502983860225,JoshMPacheco,1303377502983860225,480562828,480562828,0,0,Zendesk,Worldwide,"{'hashtags': [], 'symbols': [], 'user_mentions': [{'screen_name': 'JoshMPacheco', 'name': 'Josh Pacheco', 'id': 480562828, 'id_str': '480562828', 'indices': [0, 13]}], 'urls': []}",1005907,False,60985,False,Buffer,False,True,en,"We have 7M+ users and 75K businesses who trust us to help with social media management, visual marketing, and audience growth. Remarkable brands built here.",True,buffer,430419,False,False
266,1303380629841731584,2020-09-08 17:12:12,"@JoshMPacheco I’m so sorry about the trouble we've caused here, Joshua! I'd be happy to help out here. Do you run into the same redirection issue when you try connecting your Instagram account on the web too? Keen to get this sorted out for you! - Essence",1303377502983860225,JoshMPacheco,1303377502983860225,480562828,480562828,0,0,Zendesk,Worldwide,"{'hashtags': [], 'symbols': [], 'user_mentions': [{'screen_name': 'JoshMPacheco', 'name': 'Josh Pacheco', 'id': 480562828, 'id_str': '480562828', 'indices': [0, 13]}], 'urls': []}",1005907,False,60985,False,Buffer,False,True,en,"We have 7M+ users and 75K businesses who trust us to help with social media management, visual marketing, and audience growth. Remarkable brands built here.",True,buffer,430419,False,False
267,1303380629841731584,2020-09-08 17:12:12,"@JoshMPacheco I’m so sorry about the trouble we've caused here, Joshua! I'd be happy to help out here. Do you run into the same redirection issue when you try connecting your Instagram account on the web too? Keen to get this sorted out for you! - Essence",1303377502983860225,JoshMPacheco,1303377502983860225,480562828,480562828,0,0,Zendesk,Worldwide,"{'hashtags': [], 'symbols': [], 'user_mentions': [{'screen_name': 'JoshMPacheco', 'name': 'Josh Pacheco', 'id': 480562828, 'id_str': '480562828', 'indices': [0, 13]}], 'urls': []}",1005907,False,60985,False,Buffer,False,True,en,"We have 7M+ users and 75K businesses who trust us to help with social media management, visual marketing, and audience growth. Remarkable brands built here.",True,buffer,430419,False,False
268,1303328370692886528,2020-09-08 13:44:32,"@goldie_ Ahh, so sorry for that and for any disruption this has caused in the posts you were looking to schedule. - Danny",1302603254509875201,goldie_,1302603254509875201,18647802,18647802,0,0,Zendesk,Worldwide,"{'hashtags': [], 'symbols': [], 'user_mentions': [{'screen_name': 'goldie_', 'name': 'goldie_', 'id': 18647802, 'id_str': '18647802', 'indices': [0, 8]}], 'urls': []}",1005907,False,60985,False,Buffer,False,True,en,"We have 7M+ users and 75K businesses who trust us to help with social media management, visual marketing, and audience growth. Remarkable brands built here.",True,buffer,430419,False,False
269,1303319669831598080,2020-09-08 13:09:58,"@goldie_ If you edit the post slightly and put a full-stop or another punctuation mark in front of the letter D, that will help prevent that message from popping up for you. Please, can you try that? - Danny",1302603254509875201,goldie_,1302603254509875201,18647802,18647802,0,0,Zendesk,Worldwide,"{'hashtags': [], 'symbols': [], 'user_mentions': [{'screen_name': 'goldie_', 'name': 'goldie_', 'id': 18647802, 'id_str': '18647802', 'indices': [0, 8]}], 'urls': []}",1005907,False,60985,False,Buffer,False,True,en,"We have 7M+ users and 75K businesses who trust us to help with social media management, visual marketing, and audience growth. Remarkable brands built here.",True,buffer,430419,False,False
270,1303318604147032064,2020-09-08 13:05:44,"@marcotrulla If we can help with anything else, just let us know! -Kelly (she/her)",1299136225136316416,marcotrulla,1299136225136316416,47342938,47342938,0,0,Zendesk,Worldwide,"{'hashtags': [], 'symbols': [], 'user_mentions': [{'screen_name': 'marcotrulla', 'name': 'Marco Trulla', 'id': 47342938, 'id_str': '47342938', 'indices': [0, 12]}], 'urls': []}",1005907,False,60985,False,Buffer,False,True,en,"We have 7M+ users and 75K businesses who trust us to help with social media management, visual marketing, and audience growth. Remarkable brands built here.",True,buffer,430419,False,False
271,1303309214371188736,2020-09-08 12:28:25,"@trevoryoung One thing we've seen that works really well is to log out of Buffer, close the browser, then re-open the browser and log back in. Could you then try to upload the image again? As for the error, are you still seeing this?-Jess",1302811768998174720,trevoryoung,1302811768998174720,9930912,9930912,0,0,Zendesk,Worldwide,"{'hashtags': [], 'symbols': [], 'user_mentions': [{'screen_name': 'trevoryoung', 'name': 'Trevor Young', 'id': 9930912, 'id_str': '9930912', 'indices': [0, 12]}], 'urls': []}",1005907,False,60985,False,Buffer,False,True,en,"We have 7M+ users and 75K businesses who trust us to help with social media management, visual marketing, and audience growth. Remarkable brands built here.",True,buffer,430419,False,False
272,1303306135391424523,2020-09-08 12:16:11,"@jspeedymorris22 Thanks for reaching out! To give the best support we'll need to take a look at your account, would you send us a direct message with your email address so we can dig in further? https://t.co/7POxMH7a7o",1302209135849734145,jspeedymorris22,1302209135849734145,104932955,104932955,0,0,Zendesk,Worldwide,"{'hashtags': [], 'symbols': [], 'user_mentions': [{'screen_name': 'jspeedymorris22', 'name': 'Joseph John Morris', 'id': 104932955, 'id_str': '104932955', 'indices': [0, 16]}], 'urls': [{'url': 'https://t.co/7POxMH7a7o', 'expanded_url': 'https://twitter.com/messages/compose?recipient_id=197962366', 'display_url': 'twitter.com/messages/compo…', 'indices': [195, 218]}]}",1005907,False,60985,False,Buffer,False,True,en,"We have 7M+ users and 75K businesses who trust us to help with social media management, visual marketing, and audience growth. Remarkable brands built here.",True,buffer,430419,False,False
273,1303305962137235456,2020-09-08 12:15:30,@kalynskitchen Hi Kayln! I've replied to your tweets asking if you'd be up for sending a DM with your account details. Server errors like these are often a result of some browser settings or other connections we'll want to help you with. Looking forward to your reply! -Jess,1302071525789458433,kalynskitchen,1302071525789458433,14914613,14914613,0,0,Zendesk,Worldwide,"{'hashtags': [], 'symbols': [], 'user_mentions': [{'screen_name': 'kalynskitchen', 'name': 'Kalyn Denny', 'id': 14914613, 'id_str': '14914613', 'indices': [0, 14]}], 'urls': []}",1005907,False,60985,False,Buffer,False,True,en,"We have 7M+ users and 75K businesses who trust us to help with social media management, visual marketing, and audience growth. Remarkable brands built here.",True,buffer,430419,False,False
274,1303305873356455936,2020-09-08 12:15:09,@kalynskitchen Hi Kayln! I've replied to your tweets asking if you'd be up for sending a DM with your account details. Server errors like these are often a result of some browser settings or other connections we'll want to help you with. Looking forward to your reply! -Jess,1302984967958355968,kalynskitchen,1302984967958355968,14914613,14914613,0,0,Zendesk,Worldwide,"{'hashtags': [], 'symbols': [], 'user_mentions': [{'screen_name': 'kalynskitchen', 'name': 'Kalyn Denny', 'id': 14914613, 'id_str': '14914613', 'indices': [0, 14]}], 'urls': []}",1005907,False,60985,False,Buffer,False,True,en,"We have 7M+ users and 75K businesses who trust us to help with social media management, visual marketing, and audience growth. Remarkable brands built here.",True,buffer,430419,False,False
275,1303304392582606848,2020-09-08 12:09:16,"@kalynskitchen Thanks for reaching out! To give the best support we'll need to take a look at your account, would you send us a direct message with your email address so we can dig in further? https://t.co/7POxMH7a7o",1301872516068065287,kalynskitchen,1301872516068065287,14914613,14914613,0,0,Zendesk,Worldwide,"{'hashtags': [], 'symbols': [], 'user_mentions': [{'screen_name': 'kalynskitchen', 'name': 'Kalyn Denny', 'id': 14914613, 'id_str': '14914613', 'indices': [0, 14]}], 'urls': [{'url': 'https://t.co/7POxMH7a7o', 'expanded_url': 'https://twitter.com/messages/compose?recipient_id=197962366', 'display_url': 'twitter.com/messages/compo…', 'indices': [193, 216]}]}",1005907,False,60985,False,Buffer,False,True,en,"We have 7M+ users and 75K businesses who trust us to help with social media management, visual marketing, and audience growth. Remarkable brands built here.",True,buffer,430419,False,False
