id_no,tweet_id,tweet_created_at,tweet_text,in_reply to status_id,in_reply_to_screen_name,in_reply_to_status_id_str,in_reply_to_user_id,in_reply_to_user_id_str,favorite_count,retweet_count,source,user_location,entities,followers_count,foliowing,friends_count,follow_request_sent,user_name,user_protected,user-verified,lang,user_description,geo_enabled,user_screen_name,user_statuses_count,tweet_truncated,tweet_is_quote_status
1,1311442621726953476,2020-09-30 23:07:41,"@MummyBarrow Yikes! That's not cool. ?? I'm also sorry it's taken a while for us to see your tweet. I hadn't heard of others experiencing a lack of access today. ?? Are things looking better now, by chance? -Darcy",1311235809983565830,MummyBarrow,1311235809983565830,18685377,18685377,0,0,Zendesk,Worldwide,"{'hashtags': [], 'symbols': [], 'user_mentions': [{'screen_name': 'MummyBarrow', 'name': 'T at Mummy Barrow', 'id': 18685377, 'id_str': '18685377', 'indices': [0, 12]}], 'urls': []}",1005907,False,60985,False,Buffer,False,True,en,"We have 7M+ users and 75K businesses who trust us to help with social media management, visual marketing, and audience growth. Remarkable brands built here.",True,buffer,430419,False,False
2,1311421674974257152,2020-09-30 21:44:27,"@hellobeverley ?? Sorry Beverley, I wish we had more flexibility for what you need! -Julia",1311057569071263744,hellobeverley,1311057569071263744,15940877,15940877,1,0,Zendesk,Worldwide,"{'hashtags': [], 'symbols': [], 'user_mentions': [{'screen_name': 'hellobeverley', 'name': 'Beverley Theresa ??', 'id': 15940877, 'id_str': '15940877', 'indices': [0, 14]}], 'urls': []}",1005907,False,60985,False,Buffer,False,True,en,"We have 7M+ users and 75K businesses who trust us to help with social media management, visual marketing, and audience growth. Remarkable brands built here.",True,buffer,430419,False,False
3,1311413918288490496,2020-09-30 21:13:37,"@benjaminwthomas Heya! I'm Julia, joining in on Daniel's behalf. Good question. We do not support x-callback right now. We did have it but removed due to low usage. We're working on improving what is possible there but don't have a specific timeline right now -Julia",1310718518996938760,benjaminwthomas,1310718518996938760,805447353683574784,805447353683574784,0,0,Zendesk,Worldwide,"{'hashtags': [], 'symbols': [], 'user_mentions': [{'screen_name': 'benjaminwthomas', 'name': 'Benjamin W Thomas', 'id': 805447353683574784, 'id_str': '805447353683574784', 'indices': [0, 16]}], 'urls': []}",1005907,False,60985,False,Buffer,False,True,en,"We have 7M+ users and 75K businesses who trust us to help with social media management, visual marketing, and audience growth. Remarkable brands built here.",True,buffer,430419,False,False
4,1311399148554514432,2020-09-30 20:14:56,@thibaultmol I appreciate your heads up on this! I'll let the team know. :) -Nate,1311214458459631622,thibaultmol,1311214458459631622,201788049,201788049,1,0,Zendesk,Worldwide,"{'hashtags': [], 'symbols': [], 'user_mentions': [{'screen_name': 'thibaultmol', 'name': 'Thibault Molleman', 'id': 201788049, 'id_str': '201788049', 'indices': [0, 12]}], 'urls': []}",1005907,False,60985,False,Buffer,False,True,en,"We have 7M+ users and 75K businesses who trust us to help with social media management, visual marketing, and audience growth. Remarkable brands built here.",True,buffer,430419,False,False
5,1311352797158408193,2020-09-30 17:10:45,@benjaminwthomas Hey Benjamin! Would you be willing to hang in there with me while I loop in my team? I definitely want to make sure we square this away for you. - Daniel,1310718518996938760,benjaminwthomas,1310718518996938760,805447353683574784,805447353683574784,0,0,Zendesk,Worldwide,"{'hashtags': [], 'symbols': [], 'user_mentions': [{'screen_name': 'benjaminwthomas', 'name': 'Benjamin W Thomas', 'id': 805447353683574784, 'id_str': '805447353683574784', 'indices': [0, 16]}], 'urls': []}",1005907,False,60985,False,Buffer,False,True,en,"We have 7M+ users and 75K businesses who trust us to help with social media management, visual marketing, and audience growth. Remarkable brands built here.",True,buffer,430419,False,False
6,1311349188849012738,2020-09-30 16:56:24,"@iludido67179060  Hello?? Is there anything we can lend a hand with? If so, could you share the email address you use to sign into Buffer and a bit more information about the issue you're seeing or the question you have so we can dig in? - Essence",1311166450359570432,iludido67179060,1311166450359570432,1305942281736933382,1305942281736933382,0,0,Zendesk,Worldwide,"{'hashtags': [], 'symbols': [], 'user_mentions': [{'screen_name': 'iludido67179060', 'name': 'iludido', 'id': 1305942281736933382, 'id_str': '1305942281736933382', 'indices': [0, 16]}], 'urls': []}",1005907,False,60985,False,Buffer,False,True,en,"We have 7M+ users and 75K businesses who trust us to help with social media management, visual marketing, and audience growth. Remarkable brands built here.",True,buffer,430419,False,False
7,1311349188849012738,2020-09-30 16:56:24,"@iludido67179060  Hello?? Is there anything we can lend a hand with? If so, could you share the email address you use to sign into Buffer and a bit more information about the issue you're seeing or the question you have so we can dig in? - Essence",1311166450359570432,iludido67179060,1311166450359570432,1305942281736933382,1305942281736933382,0,0,Zendesk,Worldwide,"{'hashtags': [], 'symbols': [], 'user_mentions': [{'screen_name': 'iludido67179060', 'name': 'iludido', 'id': 1305942281736933382, 'id_str': '1305942281736933382', 'indices': [0, 16]}], 'urls': []}",1005907,False,60985,False,Buffer,False,True,en,"We have 7M+ users and 75K businesses who trust us to help with social media management, visual marketing, and audience growth. Remarkable brands built here.",True,buffer,430419,False,False
8,1311294417840623618,2020-09-30 13:18:46,"Say ?? to Messenger: Instagram just announced 11 new messaging features, including selfie stickers, chat colors, and forwarding. Check them out below! ??https://t.co/PJGeId0LKZ https://t.co/4KRLCsUIV7",None,None,None,None,None,23,9,Buffer,Worldwide,"{'hashtags': [], 'symbols': [], 'user_mentions': [], 'urls': [{'url': 'https://t.co/PJGeId0LKZ', 'expanded_url': 'https://about.fb.com/news/2020/09/new-messaging-features-for-instagram/', 'display_url': 'about.fb.com/news/2020/09/n…', 'indices': [152, 175]}], 'media': [{'id': 1311294415806386177, 'id_str': '1311294415806386177', 'indices': [176, 199], 'media_url': 'http://pbs.twimg.com/media/EjKnUtoX0AEEjXd.jpg', 'media_url_https': 'https://pbs.twimg.com/media/EjKnUtoX0AEEjXd.jpg', 'url': 'https://t.co/4KRLCsUIV7', 'display_url': 'pic.twitter.com/4KRLCsUIV7', 'expanded_url': 'https://twitter.com/buffer/status/1311294417840623618/photo/1', 'type': 'photo', 'sizes': {'medium': {'w': 1025, 'h': 1200, 'resize': 'fit'}, 'small': {'w': 581, 'h': 680, 'resize': 'fit'}, 'thumb': {'w': 150, 'h': 150, 'resize': 'crop'}, 'large': {'w': 1150, 'h': 1346, 'resize': 'fit'}}}]}",1005907,False,60985,False,Buffer,False,True,en,"We have 7M+ users and 75K businesses who trust us to help with social media management, visual marketing, and audience growth. Remarkable brands built here.",True,buffer,430419,False,False
9,1311292218112606209,2020-09-30 13:10:02,"RT @messenger: There’s a new Messenger experience coming to @instagram. Check it all out here, https://t.co/GrkyCVkUDk. https://t.co/kixHge…",None,None,None,None,None,0,77,Twitter Web App,Worldwide,"{'hashtags': [], 'symbols': [], 'user_mentions': [{'screen_name': 'messenger', 'name': 'Messenger', 'id': 2885229365, 'id_str': '2885229365', 'indices': [3, 13]}, {'screen_name': 'instagram', 'name': 'Instagram', 'id': 180505807, 'id_str': '180505807', 'indices': [60, 70]}], 'urls': [{'url': 'https://t.co/GrkyCVkUDk', 'expanded_url': 'http://bit.ly/Msgr-IG', 'display_url': 'bit.ly/Msgr-IG', 'indices': [95, 118]}]}",1005907,False,60985,False,Buffer,False,True,en,"We have 7M+ users and 75K businesses who trust us to help with social media management, visual marketing, and audience growth. Remarkable brands built here.",True,buffer,430419,False,False
10,1311282822146072576,2020-09-30 12:32:41,"@erukidesu Hi there, Elki, thank you so much for holding us accountable on this, and I do apologise that we haven't been able to move as quickly on this specific feature. I'll make sure your voice is heard. Please let me know if I could help in any other way in the meantime. -...",1310991112241393665,erukidesu,1310991112241393665,173475523,173475523,2,0,Zendesk,Worldwide,"{'hashtags': [], 'symbols': [], 'user_mentions': [{'screen_name': 'erukidesu', 'name': 'Elki', 'id': 173475523, 'id_str': '173475523', 'indices': [0, 10]}], 'urls': []}",1005907,False,60985,False,Buffer,False,True,en,"We have 7M+ users and 75K businesses who trust us to help with social media management, visual marketing, and audience growth. Remarkable brands built here.",True,buffer,430419,False,False
11,1311237158498377729,2020-09-30 09:31:14,"@jcbivins Thanks for reaching out, Jereme! To give the best support, we'll need to take a look at your account. Would you send us a direct message with your email address so we can dig in further? https://t.co/7POxMH7a7o",1310940059496046605,jcbivins,1310940059496046605,86359331,86359331,0,0,Zendesk,Worldwide,"{'hashtags': [], 'symbols': [], 'user_mentions': [{'screen_name': 'jcbivins', 'name': 'Jereme Bivins', 'id': 86359331, 'id_str': '86359331', 'indices': [0, 9]}], 'urls': [{'url': 'https://t.co/7POxMH7a7o', 'expanded_url': 'https://twitter.com/messages/compose?recipient_id=197962366', 'display_url': 'twitter.com/messages/compo…', 'indices': [197, 220]}]}",1005907,False,60985,False,Buffer,False,True,en,"We have 7M+ users and 75K businesses who trust us to help with social media management, visual marketing, and audience growth. Remarkable brands built here.",True,buffer,430419,False,False
12,1311207119421689856,2020-09-30 07:31:52,"@leanderwattig That's useful! ?? 
We would expect that to be working on the desktop too, so if you'd like us to take a closer look and figure this out, please do drop us a DM any time ?? 
-?Dave",1310574698024050689,leanderwattig,1310574698024050689,9739592,9739592,0,0,Zendesk,Worldwide,"{'hashtags': [], 'symbols': [], 'user_mentions': [{'screen_name': 'leanderwattig', 'name': 'Leander Wattig', 'id': 9739592, 'id_str': '9739592', 'indices': [0, 14]}], 'urls': []}",1005907,False,60985,False,Buffer,False,True,en,"We have 7M+ users and 75K businesses who trust us to help with social media management, visual marketing, and audience growth. Remarkable brands built here.",True,buffer,430419,False,False
13,1311202621475164161,2020-09-30 07:14:00,What’s your number one tip or piece of advice for succeeding in social media?,None,None,None,None,None,27,3,Buffer,Worldwide,"{'hashtags': [], 'symbols': [], 'user_mentions': [], 'urls': []}",1005907,False,60985,False,Buffer,False,True,en,"We have 7M+ users and 75K businesses who trust us to help with social media management, visual marketing, and audience growth. Remarkable brands built here.",True,buffer,430419,False,False
14,1311137682412769281,2020-09-30 02:55:57,"@hellobeverley Hey Beverley! I can see here that Julia has been in touch with you, if there's anything else we can help with please don't hesitate to get back to me :) -James",1311057569071263744,hellobeverley,1311057569071263744,15940877,15940877,1,0,Zendesk,Worldwide,"{'hashtags': [], 'symbols': [], 'user_mentions': [{'screen_name': 'hellobeverley', 'name': 'Beverley Theresa ??', 'id': 15940877, 'id_str': '15940877', 'indices': [0, 14]}], 'urls': []}",1005907,False,60985,False,Buffer,False,True,en,"We have 7M+ users and 75K businesses who trust us to help with social media management, visual marketing, and audience growth. Remarkable brands built here.",True,buffer,430419,False,False
15,1311118705045143553,2020-09-30 01:40:33,"@jdaviescoates Hey Josef! You're right, we did sunset Reply (more on that here: https://t.co/5ndrfSBbu6), but we are currently working on something that we hope to release in the near future. You can follow along here on our roadmap &gt;&gt; https://t.co/QBE4KA0wYd -James",1310906583392677888,jdaviescoates,1310906583392677888,11402552,11402552,0,0,Zendesk,Worldwide,"{'hashtags': [], 'symbols': [], 'user_mentions': [{'screen_name': 'jdaviescoates', 'name': 'Josef Davies-Coates', 'id': 11402552, 'id_str': '11402552', 'indices': [0, 14]}], 'urls': [{'url': 'https://t.co/5ndrfSBbu6', 'expanded_url': 'https://buff.ly/2BPIpHv', 'display_url': 'buff.ly/2BPIpHv', 'indices': [80, 103]}, {'url': 'https://t.co/QBE4KA0wYd', 'expanded_url': 'https://trello.com/b/PDIV7XW3/buffer-transparent-product-roadmap', 'display_url': 'trello.com/b/PDIV7XW3/buf…', 'indices': [242, 265]}]}",1005907,False,60985,False,Buffer,False,True,en,"We have 7M+ users and 75K businesses who trust us to help with social media management, visual marketing, and audience growth. Remarkable brands built here.",True,buffer,430419,False,False
16,1311067227081277443,2020-09-29 22:16:00,"@mearchita Thanks for trying it out, Archita! ?? Grateful for you! -Julia",1310832179102887936,mearchita,1310832179102887936,312063692,312063692,1,0,Zendesk,Worldwide,"{'hashtags': [], 'symbols': [], 'user_mentions': [{'screen_name': 'mearchita', 'name': 'Archita Sharma', 'id': 312063692, 'id_str': '312063692', 'indices': [0, 10]}], 'urls': []}",1005907,False,60985,False,Buffer,False,True,en,"We have 7M+ users and 75K businesses who trust us to help with social media management, visual marketing, and audience growth. Remarkable brands built here.",True,buffer,430419,False,False
17,1311064800420601856,2020-09-29 22:06:21,@hellobeverley Hey Beverley! The best route would be to give Analyze a try for Reporting capabilities :) -Julia,1310757947455074304,hellobeverley,1310757947455074304,15940877,15940877,0,0,Zendesk,Worldwide,"{'hashtags': [], 'symbols': [], 'user_mentions': [{'screen_name': 'hellobeverley', 'name': 'Beverley Theresa ??', 'id': 15940877, 'id_str': '15940877', 'indices': [0, 14]}], 'urls': []}",1005907,False,60985,False,Buffer,False,True,en,"We have 7M+ users and 75K businesses who trust us to help with social media management, visual marketing, and audience growth. Remarkable brands built here.",True,buffer,430419,False,False
18,1311049146216976386,2020-09-29 21:04:09,"@benjaminwthomas Great question, Benjamin! Would you be willing to reply with a URL scheme or shortcut for me to try and schedule? I'm having a hard time pinning one down myself though would love to get this squared away for you. - Daniel",1310718518996938760,benjaminwthomas,1310718518996938760,805447353683574784,805447353683574784,0,0,Zendesk,Worldwide,"{'hashtags': [], 'symbols': [], 'user_mentions': [{'screen_name': 'benjaminwthomas', 'name': 'Benjamin W Thomas', 'id': 805447353683574784, 'id_str': '805447353683574784', 'indices': [0, 16]}], 'urls': []}",1005907,False,60985,False,Buffer,False,True,en,"We have 7M+ users and 75K businesses who trust us to help with social media management, visual marketing, and audience growth. Remarkable brands built here.",True,buffer,430419,False,False
19,1310932878826655744,2020-09-29 13:22:08,"@hit35surbiton Thanks for reaching out! To give the best support we'll need to take a look at your account, would you send us a direct message with your email address so we can dig in further? https://t.co/7POxMH7a7o",1310581545032470530,hit35surbiton,1310581545032470530,855800058377273344,855800058377273344,0,0,Zendesk,Worldwide,"{'hashtags': [], 'symbols': [], 'user_mentions': [{'screen_name': 'hit35surbiton', 'name': 'HIT35 Bootcamp', 'id': 855800058377273344, 'id_str': '855800058377273344', 'indices': [0, 14]}], 'urls': [{'url': 'https://t.co/7POxMH7a7o', 'expanded_url': 'https://twitter.com/messages/compose?recipient_id=197962366', 'display_url': 'twitter.com/messages/compo…', 'indices': [193, 216]}]}",1005907,False,60985,False,Buffer,False,True,en,"We have 7M+ users and 75K businesses who trust us to help with social media management, visual marketing, and audience growth. Remarkable brands built here.",True,buffer,430419,False,False
20,1310930615135600641,2020-09-29 13:13:09,"@leanderwattig Thanks for reaching out! The link should still work... Can I take a look at your account? Please send us a direct message with your email address so I can dig in further if that's ok
-Dave
https://t.co/7POxMH7a7o",1310574698024050689,leanderwattig,1310574698024050689,9739592,9739592,0,0,Zendesk,Worldwide,"{'hashtags': [], 'symbols': [], 'user_mentions': [{'screen_name': 'leanderwattig', 'name': 'Leander Wattig', 'id': 9739592, 'id_str': '9739592', 'indices': [0, 14]}], 'urls': [{'url': 'https://t.co/7POxMH7a7o', 'expanded_url': 'https://twitter.com/messages/compose?recipient_id=197962366', 'display_url': 'twitter.com/messages/compo…', 'indices': [204, 227]}]}",1005907,False,60985,False,Buffer,False,True,en,"We have 7M+ users and 75K businesses who trust us to help with social media management, visual marketing, and audience growth. Remarkable brands built here.",True,buffer,430419,False,False
21,1310924600281309187,2020-09-29 12:49:15,"@erukidesu Thanks so much for the feedback and nudge on this - I'd love it if we're able to add this functionality sooner rather than later, too ?? - Danny",1309457801907974144,erukidesu,1309457801907974144,173475523,173475523,0,0,Zendesk,Worldwide,"{'hashtags': [], 'symbols': [], 'user_mentions': [{'screen_name': 'erukidesu', 'name': 'Elki', 'id': 173475523, 'id_str': '173475523', 'indices': [0, 10]}], 'urls': []}",1005907,False,60985,False,Buffer,False,True,en,"We have 7M+ users and 75K businesses who trust us to help with social media management, visual marketing, and audience growth. Remarkable brands built here.",True,buffer,430419,False,False
22,1310915732360790023,2020-09-29 12:14:00,"Have you tried Instagram Reels' newest feature updates? Instagram announced last week that they made some tweaks to make it easier to make reels you love: 
?? Create a reel up to 30 seconds
? Extend the timer to 10 seconds when you’re recording 
?? Trim and delete any clip",None,None,None,None,None,6,5,Buffer,Worldwide,"{'hashtags': [], 'symbols': [], 'user_mentions': [], 'urls': []}",1005907,False,60985,False,Buffer,False,True,en,"We have 7M+ users and 75K businesses who trust us to help with social media management, visual marketing, and audience growth. Remarkable brands built here.",True,buffer,430419,False,False
23,1310863286838210560,2020-09-29 08:45:36,"@erukidesu So sorry for the trouble on this! We do have alt text available for Twitter, yet it's not something we have available for Facebook. It's on our engineering team's radar &amp; is something we do hope to be able to add in the future, yet we don't have ETA currently - Danny",1309457801907974144,erukidesu,1309457801907974144,173475523,173475523,0,0,Zendesk,Worldwide,"{'hashtags': [], 'symbols': [], 'user_mentions': [{'screen_name': 'erukidesu', 'name': 'Elki', 'id': 173475523, 'id_str': '173475523', 'indices': [0, 10]}], 'urls': []}",1005907,False,60985,False,Buffer,False,True,en,"We have 7M+ users and 75K businesses who trust us to help with social media management, visual marketing, and audience growth. Remarkable brands built here.",True,buffer,430419,False,False
24,1310731529581142016,2020-09-29 00:02:03,"@mollydett No problem at all, Molly! We're here if you need a hand with anything else! ??",1310647192500215809,mollydett,1310647192500215809,341307079,341307079,0,0,Zendesk,Worldwide,"{'hashtags': [], 'symbols': [], 'user_mentions': [{'screen_name': 'mollydett', 'name': 'Molly Dettmann', 'id': 341307079, 'id_str': '341307079', 'indices': [0, 10]}], 'urls': []}",1005907,False,60985,False,Buffer,False,True,en,"We have 7M+ users and 75K businesses who trust us to help with social media management, visual marketing, and audience growth. Remarkable brands built here.",True,buffer,430419,False,False
25,1310727423605047296,2020-09-28 23:45:44,"@AlonaDecade Sure thing, to give the best support we'll need to take a look at your account, would you send us a direct message with your email address so we can dig in further? https://t.co/7POxMH7a7o

Looking forward to chatting with you soon! - Essence",1310380161670545409,AlonaDecade,1310380161670545409,1258075604794183688,1258075604794183688,0,0,Zendesk,Worldwide,"{'hashtags': [], 'symbols': [], 'user_mentions': [{'screen_name': 'AlonaDecade', 'name': 'Voice Like Lavender', 'id': 1258075604794183688, 'id_str': '1258075604794183688', 'indices': [0, 12]}], 'urls': [{'url': 'https://t.co/7POxMH7a7o', 'expanded_url': 'https://twitter.com/messages/compose?recipient_id=197962366', 'display_url': 'twitter.com/messages/compo…', 'indices': [178, 201]}]}",1005907,False,60985,False,Buffer,False,True,en,"We have 7M+ users and 75K businesses who trust us to help with social media management, visual marketing, and audience growth. Remarkable brands built here.",True,buffer,430419,False,False
26,1310694039218524161,2020-09-28 21:33:05,"@InsurTechEd Ahh, sorry Ed. I'm afraid it isn't possible to tag LinkedIn updates, I'm really sorry about this limitation on our end. I'll make sure to share this as a feature request with my team. If I can help further, please let me know! - Daniel",1310230853893619713,InsurTechEd,1310230853893619713,836995833757384713,836995833757384713,1,0,Zendesk,Worldwide,"{'hashtags': [], 'symbols': [], 'user_mentions': [{'screen_name': 'InsurTechEd', 'name': 'Ed Halsey ??', 'id': 836995833757384713, 'id_str': '836995833757384713', 'indices': [0, 12]}], 'urls': []}",1005907,False,60985,False,Buffer,False,True,en,"We have 7M+ users and 75K businesses who trust us to help with social media management, visual marketing, and audience growth. Remarkable brands built here.",True,buffer,430419,False,False
27,1310694039218524161,2020-09-28 21:33:05,"@InsurTechEd Ahh, sorry Ed. I'm afraid it isn't possible to tag LinkedIn updates, I'm really sorry about this limitation on our end. I'll make sure to share this as a feature request with my team. If I can help further, please let me know! - Daniel",1310230853893619713,InsurTechEd,1310230853893619713,836995833757384713,836995833757384713,1,0,Zendesk,Worldwide,"{'hashtags': [], 'symbols': [], 'user_mentions': [{'screen_name': 'InsurTechEd', 'name': 'Ed Halsey ??', 'id': 836995833757384713, 'id_str': '836995833757384713', 'indices': [0, 12]}], 'urls': []}",1005907,False,60985,False,Buffer,False,True,en,"We have 7M+ users and 75K businesses who trust us to help with social media management, visual marketing, and audience growth. Remarkable brands built here.",True,buffer,430419,False,False
28,1310683757742034944,2020-09-28 20:52:13,"@itscharliecrown Hey Charlie! Great question. We're working on it, feel free to follow our progress on our transparent product roadmap here! &gt; https://t.co/QBE4KA0wYd If I can help further, please let me know. &gt; Daniel",1309846411337498624,itscharliecrown,1309846411337498624,296911105,296911105,1,0,Zendesk,Worldwide,"{'hashtags': [], 'symbols': [], 'user_mentions': [{'screen_name': 'itscharliecrown', 'name': 'Charlie Crown (fka Flapo)', 'id': 296911105, 'id_str': '296911105', 'indices': [0, 16]}], 'urls': [{'url': 'https://t.co/QBE4KA0wYd', 'expanded_url': 'https://trello.com/b/PDIV7XW3/buffer-transparent-product-roadmap', 'display_url': 'trello.com/b/PDIV7XW3/buf…', 'indices': [146, 169]}]}",1005907,False,60985,False,Buffer,False,True,en,"We have 7M+ users and 75K businesses who trust us to help with social media management, visual marketing, and audience growth. Remarkable brands built here.",True,buffer,430419,False,False
29,1310648518437203976,2020-09-28 18:32:12,"@mollydett If you choose not to upgrade once your trial ends, your Buffer account will downgrade to our Free plan! - Essence",1310647192500215809,mollydett,1310647192500215809,341307079,341307079,1,0,Zendesk,Worldwide,"{'hashtags': [], 'symbols': [], 'user_mentions': [{'screen_name': 'mollydett', 'name': 'Molly Dettmann', 'id': 341307079, 'id_str': '341307079', 'indices': [0, 10]}], 'urls': []}",1005907,False,60985,False,Buffer,False,True,en,"We have 7M+ users and 75K businesses who trust us to help with social media management, visual marketing, and audience growth. Remarkable brands built here.",True,buffer,430419,False,False
30,1310648414317752320,2020-09-28 18:31:47,"@mollydett We're sorry for any confusion we've caused here, Molly! We don't have a direct signup link to our Free plan at this time, sadly. I'm sorry about that! However, you can sign up for a free trial for one of our plans found here: https://t.co/sOmBYP0DCz - Essence",1310647192500215809,mollydett,1310647192500215809,341307079,341307079,0,0,Zendesk,Worldwide,"{'hashtags': [], 'symbols': [], 'user_mentions': [{'screen_name': 'mollydett', 'name': 'Molly Dettmann', 'id': 341307079, 'id_str': '341307079', 'indices': [0, 10]}], 'urls': [{'url': 'https://t.co/sOmBYP0DCz', 'expanded_url': 'https://buffer.com/pricing/publish', 'display_url': 'buffer.com/pricing/publish', 'indices': [237, 260]}]}",1005907,False,60985,False,Buffer,False,True,en,"We have 7M+ users and 75K businesses who trust us to help with social media management, visual marketing, and audience growth. Remarkable brands built here.",True,buffer,430419,False,False
