id_no,tweet_id,tweet_created_at,tweet_text,in_reply to status_id,in_reply_to_screen_name,in_reply_to_status_id_str,in_reply_to_user_id,in_reply_to_user_id_str,favorite_count,retweet_count,source,user_location,entities,followers_count,foliowing,friends_count,follow_request_sent,user_name,user_protected,user-verified,lang,user_description,geo_enabled,user_screen_name,user_statuses_count,tweet_truncated,tweet_is_quote_status
168,1301137004906926080,2020-09-02 12:36:50,"@shawnzukie Oh no! Don't roll out those papers &amp; flush your marriage down the toilet just yet, Shawn. ???? Just show them the Charmin way, &amp; they'll turn around. ?? We promise! Grab a coupon at https://t.co/5Buaa8t8EF to help get you both back to enjoying the go with Charmin again. ?? ?? ??",1301120638149681152,shawnzukie,1301120638149681152,1664581435,1664581435,1,0,Sprinklr,,"{'hashtags': [], 'symbols': [], 'user_mentions': [{'screen_name': 'shawnzukie', 'name': '(????)? ? SdubR ?????', 'id': 1664581435, 'id_str': '1664581435', 'indices': [0, 11]}], 'urls': [{'url': 'https://t.co/5Buaa8t8EF', 'expanded_url': 'http://spr.ly/6011GUhCD', 'display_url': 'spr.ly/6011GUhCD', 'indices': [199, 222]}]}",84852,False,4128,False,Charmin,False,True,en,Enjoy the go.,False,Charmin,15293,False,False
169,1301133834034065408,2020-09-02 12:24:14,@Mudd4u We're behind you on this one! ?? #tweetfromtheseat,1301107854720466945,Mudd4u,1301107854720466945,897653797807243264,897653797807243264,1,0,Sprinklr,,"{'hashtags': [{'text': 'tweetfromtheseat', 'indices': [40, 57]}], 'symbols': [], 'user_mentions': [{'screen_name': 'Mudd4u', 'name': 'Mudd Mudderson', 'id': 897653797807243264, 'id_str': '897653797807243264', 'indices': [0, 7]}], 'urls': []}",84852,False,4128,False,Charmin,False,True,en,Enjoy the go.,False,Charmin,15293,False,False
170,1301132577319854080,2020-09-02 12:19:14,@UrDesertdIsland Beary great sketch! We love it. ??,1301054771336548352,UrDesertdIsland,1301054771336548352,1256380673780322305,1256380673780322305,1,0,Sprinklr,,"{'hashtags': [], 'symbols': [], 'user_mentions': [{'screen_name': 'UrDesertdIsland', 'name': 'frederic isley nook', 'id': 1256380673780322305, 'id_str': '1256380673780322305', 'indices': [0, 16]}], 'urls': []}",84852,False,4128,False,Charmin,False,True,en,Enjoy the go.,False,Charmin,15293,False,False
171,1301130045935751170,2020-09-02 12:09:11,"@stephcrouppen ?? Sometimes you're got to make the tough decisions. In this case tough for them. ?? We're glad to be back and rolling with you, even if it's just in your bathroom. ??",1300912379157450754,stephcrouppen,1300912379157450754,2821328699,2821328699,2,0,Sprinklr,,"{'hashtags': [], 'symbols': [], 'user_mentions': [{'screen_name': 'stephcrouppen', 'name': 'Stephanie Crouppen', 'id': 2821328699, 'id_str': '2821328699', 'indices': [0, 14]}], 'urls': []}",84852,False,4128,False,Charmin,False,True,en,Enjoy the go.,False,Charmin,15293,False,False
172,1300807784640937986,2020-09-01 14:48:38,"@ByeGone1 We roll out a variety of different rolls, and if wider is your thing, we'd suggest our jumbo roll. It's our widest roll yet at 4.5 x 4.0 inches vs the standard 3.92 x 4.0 inches measurement. You can find jumbo at most bulk retailers. Feel free to DM us with any further questions.",1300806792876879878,ByeGone1,1300806792876879878,869592891315847168,869592891315847168,0,0,Sprinklr,,"{'hashtags': [], 'symbols': [], 'user_mentions': [{'screen_name': 'ByeGone1', 'name': 'Bye-Gone', 'id': 869592891315847168, 'id_str': '869592891315847168', 'indices': [0, 9]}], 'urls': []}",84852,False,4128,False,Charmin,False,True,en,Enjoy the go.,False,Charmin,15293,False,False
173,1300779134034096136,2020-09-01 12:54:47,"@RitaBway2B No need to remodel, Rita. Just grab an extender on us at https://t.co/JoPlRkV2UH to help you roll mega with ease!",1300543369094017024,RitaBway2B,1300543369094017024,741759822,741759822,1,0,Sprinklr,,"{'hashtags': [], 'symbols': [], 'user_mentions': [{'screen_name': 'RitaBway2B', 'name': 'Scorpiox2', 'id': 741759822, 'id_str': '741759822', 'indices': [0, 11]}], 'urls': [{'url': 'https://t.co/JoPlRkV2UH', 'expanded_url': 'http://spr.ly/6014GUW6s', 'display_url': 'spr.ly/6014GUW6s', 'indices': [69, 92]}]}",84852,False,4128,False,Charmin,False,True,en,Enjoy the go.,False,Charmin,15293,False,False
174,1300778764381687808,2020-09-01 12:53:19,"@Merican_Infidel We hope to have our Forever Rolls rolling out in the upcoming weeks, so you can go all month long once again. We thank you for your patience and loyalty, and hope you'll keep an eye on your email for updates when stock returns.",1300467640520118273,Merican_Infidel,1300467640520118273,2788410359,2788410359,0,0,Sprinklr,,"{'hashtags': [], 'symbols': [], 'user_mentions': [{'screen_name': 'Merican_Infidel', 'name': 'General Misconduct', 'id': 2788410359, 'id_str': '2788410359', 'indices': [0, 16]}], 'urls': []}",84852,False,4128,False,Charmin,False,True,en,Enjoy the go.,False,Charmin,15293,False,False
175,1300525910412668935,2020-08-31 20:08:34,"@Shineypinguin We are sorry to hear about this, and would to assist you further. Can you please DM us with your order number?",1299921686024855555,Shineypinguin,1299921686024855555,168498243,168498243,1,0,Sprinklr,,"{'hashtags': [], 'symbols': [], 'user_mentions': [{'screen_name': 'Shineypinguin', 'name': 'Bee Bliss', 'id': 168498243, 'id_str': '168498243', 'indices': [0, 14]}], 'urls': []}",84852,False,4128,False,Charmin,False,True,en,Enjoy the go.,False,Charmin,15293,False,False
176,1300446031813971970,2020-08-31 14:51:09,"@dianabeaa We want our TP to be Ultra Strong, butt not rough on your behind, and we're beary sorry to hear you had this experience. We'd like to see how we can help and learn more. Could you roll us a quick PM, and share with us the UPC or photos of your packaging?",1300424093913808897,dianabeaa,1300424093913808897,54554727,54554727,0,0,Sprinklr,,"{'hashtags': [], 'symbols': [], 'user_mentions': [{'screen_name': 'dianabeaa', 'name': 'di', 'id': 54554727, 'id_str': '54554727', 'indices': [0, 10]}], 'urls': []}",84852,False,4128,False,Charmin,False,True,en,Enjoy the go.,False,Charmin,15293,False,False
177,1300442888258674688,2020-08-31 14:38:40,"@SplittingStuff That's quite the love, Zach. ?? ?? ?? We wish you the beary best!",1300183394295390210,SplittingStuff,1300183394295390210,846076605281775617,846076605281775617,1,0,Sprinklr,,"{'hashtags': [], 'symbols': [], 'user_mentions': [{'screen_name': 'SplittingStuff', 'name': 'Zach', 'id': 846076605281775617, 'id_str': '846076605281775617', 'indices': [0, 15]}], 'urls': []}",84852,False,4128,False,Charmin,False,True,en,Enjoy the go.,False,Charmin,15293,False,False
178,1300438792134897664,2020-08-31 14:22:23,"@artielaughs Depending on you, and your soon-to be partner's preferences, we've got it all! Soft, Strong, Gentle. Just roll on over to https://t.co/8bQLSKgCRB and take your pick. After all, who needs a diamond when you've got Charmin? ?? ?? ??",1299529991332397056,artielaughs,1299529991332397056,1134284627600859136,1134284627600859136,1,0,Sprinklr,,"{'hashtags': [], 'symbols': [], 'user_mentions': [{'screen_name': 'artielaughs', 'name': 'Artie Valenzuela', 'id': 1134284627600859136, 'id_str': '1134284627600859136', 'indices': [0, 12]}], 'urls': [{'url': 'https://t.co/8bQLSKgCRB', 'expanded_url': 'http://spr.ly/6017GUrOF', 'display_url': 'spr.ly/6017GUrOF', 'indices': [135, 158]}]}",84852,False,4128,False,Charmin,False,True,en,Enjoy the go.,False,Charmin,15293,False,False
179,1300436021679714305,2020-08-31 14:11:23,@Clyatt P.S. We love your photo back when you were Rolling in it Forever! ?? ??,1300306161976057856,Clyatt,1300306161976057856,71142272,71142272,1,0,Sprinklr,,"{'hashtags': [], 'symbols': [], 'user_mentions': [{'screen_name': 'Clyatt', 'name': 'Kirk Clyatt', 'id': 71142272, 'id_str': '71142272', 'indices': [0, 7]}], 'urls': []}",84852,False,4128,False,Charmin,False,True,en,Enjoy the go.,False,Charmin,15293,False,False
180,1300435755131641856,2020-08-31 14:10:19,"@Clyatt We hope to get you stocked up again beary soon, Kirk! Our Forever Rolls should be back in stock in the upcoming weeks. We'll be sending all our loyal users an email update when new and one-time orders open up again!",1300306161976057856,Clyatt,1300306161976057856,71142272,71142272,0,0,Sprinklr,,"{'hashtags': [], 'symbols': [], 'user_mentions': [{'screen_name': 'Clyatt', 'name': 'Kirk Clyatt', 'id': 71142272, 'id_str': '71142272', 'indices': [0, 7]}], 'urls': []}",84852,False,4128,False,Charmin,False,True,en,Enjoy the go.,False,Charmin,15293,False,False
181,1300431999187005441,2020-08-31 13:55:24,@BangGoTheBells We're just there to help you enjoy the go when you need us. Even if it's not right now. ?? ??,1300108275338313730,BangGoTheBells,1300108275338313730,3194492647,3194492647,0,0,Sprinklr,,"{'hashtags': [], 'symbols': [], 'user_mentions': [{'screen_name': 'BangGoTheBells', 'name': 'Bang Go The Bells', 'id': 3194492647, 'id_str': '3194492647', 'indices': [0, 15]}], 'urls': []}",84852,False,4128,False,Charmin,False,True,en,Enjoy the go.,False,Charmin,15293,False,False
182,1300430962032082944,2020-08-31 13:51:16,"@Irngutaq2 We package our rolls to meet the needs of our customers, in which some stores want individ wrapped pks &amp; others prefer larger pks. We're committed our environment &amp; sustainability: https://t.co/TDnzyo6XPc &amp; also a part of Alliance to End Plastic Waste: https://t.co/6nTlI3sTd5",1300118654768406529,Irngutaq2,1300118654768406529,1120498272164933632,1120498272164933632,1,0,Sprinklr,,"{'hashtags': [], 'symbols': [], 'user_mentions': [{'screen_name': 'Irngutaq2', 'name': 'Gordy Kidlapik ??E1-644', 'id': 1120498272164933632, 'id_str': '1120498272164933632', 'indices': [0, 10]}], 'urls': [{'url': 'https://t.co/TDnzyo6XPc', 'expanded_url': 'http://spr.ly/6016GUR9y', 'display_url': 'spr.ly/6016GUR9y', 'indices': [200, 223]}, {'url': 'https://t.co/6nTlI3sTd5', 'expanded_url': 'http://spr.ly/6017GUR9J', 'display_url': 'spr.ly/6017GUR9J', 'indices': [276, 299]}]}",84852,False,4128,False,Charmin,False,True,en,Enjoy the go.,False,Charmin,15293,False,False
183,1300429473477779457,2020-08-31 13:45:21,@dog_tard We're beary sorry for the delay. We hope to have our Forever Roll available again in the upcoming weeks. Then you can roll all month long on just one roll again!,1299742913321205761,Dog_tard,1299742913321205761,1290788903931305986,1290788903931305986,0,0,Sprinklr,,"{'hashtags': [], 'symbols': [], 'user_mentions': [{'screen_name': 'Dog_tard', 'name': '‘ ??,', 'id': 1290788903931305986, 'id_str': '1290788903931305986', 'indices': [0, 9]}], 'urls': []}",84852,False,4128,False,Charmin,False,True,en,Enjoy the go.,False,Charmin,15293,False,False
184,1300417409287892992,2020-08-31 12:57:25,@grisham_shrew60 That's the best kind of approved. ?? ?? ??,1300267603491991554,grisham_shrew60,1300267603491991554,4789262422,4789262422,2,0,Sprinklr,,"{'hashtags': [], 'symbols': [], 'user_mentions': [{'screen_name': 'grisham_shrew60', 'name': 'I Am WOMAN; Hear Me Roar!', 'id': 4789262422, 'id_str': '4789262422', 'indices': [0, 16]}], 'urls': []}",84852,False,4128,False,Charmin,False,True,en,Enjoy the go.,False,Charmin,15293,False,False
185,1300415730027028480,2020-08-31 12:50:45,"@khanadarhodes We promise, we're wroth the wait, Katie, and we're beary sorry it's been so long. We hope to have our rolls available in the upcoming weeks. Just roll over to https://t.co/UtVQum9toY to sign up for updates.",1299939618817814528,khanadarhodes,1299939618817814528,30642913,30642913,0,0,Sprinklr,,"{'hashtags': [], 'symbols': [], 'user_mentions': [{'screen_name': 'khanadarhodes', 'name': 'Katie ?? | ??????? | 1??3??1??2??', 'id': 30642913, 'id_str': '30642913', 'indices': [0, 14]}], 'urls': [{'url': 'https://t.co/UtVQum9toY', 'expanded_url': 'http://spr.ly/6014GUuui', 'display_url': 'spr.ly/6014GUuui', 'indices': [174, 197]}]}",84852,False,4128,False,Charmin,False,True,en,Enjoy the go.,False,Charmin,15293,False,False
186,1300411122265325570,2020-08-31 12:32:26,"@Kato_Kaelin ?? That's beary adorable, butt the question remains are they Ultra Soft, Ultra Strong or Ultra Gentle. ?? Thanks so much for your loyalty.",1299418699275931648,Kato_Kaelin,1299418699275931648,582050750,582050750,0,0,Sprinklr,,"{'hashtags': [], 'symbols': [], 'user_mentions': [{'screen_name': 'Kato_Kaelin', 'name': 'Kato Kaelin', 'id': 582050750, 'id_str': '582050750', 'indices': [0, 12]}], 'urls': []}",84852,False,4128,False,Charmin,False,True,en,Enjoy the go.,False,Charmin,15293,False,False
187,1300411122265325570,2020-08-31 12:32:26,"@Kato_Kaelin ?? That's beary adorable, butt the question remains are they Ultra Soft, Ultra Strong or Ultra Gentle. ?? Thanks so much for your loyalty.",1299418699275931648,Kato_Kaelin,1299418699275931648,582050750,582050750,0,0,Sprinklr,,"{'hashtags': [], 'symbols': [], 'user_mentions': [{'screen_name': 'Kato_Kaelin', 'name': 'Kato Kaelin', 'id': 582050750, 'id_str': '582050750', 'indices': [0, 12]}], 'urls': []}",84852,False,4128,False,Charmin,False,True,en,Enjoy the go.,False,Charmin,15293,False,False
188,1300410950139420673,2020-08-31 12:31:45,"@KevnJr Clean and soft, the perfect catch for whatever is thrown your way!",1299505431165964288,KevnJr,1299505431165964288,255781054,255781054,0,0,Sprinklr,,"{'hashtags': [], 'symbols': [], 'user_mentions': [{'screen_name': 'KevnJr', 'name': 'Kevin Smith', 'id': 255781054, 'id_str': '255781054', 'indices': [0, 7]}], 'urls': []}",84852,False,4128,False,Charmin,False,True,en,Enjoy the go.,False,Charmin,15293,False,False
189,1300410555761655808,2020-08-31 12:30:11,@connellybt Papa Bear's skills go beyond the bathroom... ??,1299503834222522368,connellybt,1299503834222522368,369617987,369617987,0,0,Sprinklr,,"{'hashtags': [], 'symbols': [], 'user_mentions': [{'screen_name': 'connellybt', 'name': 'Brendan Connelly', 'id': 369617987, 'id_str': '369617987', 'indices': [0, 11]}], 'urls': []}",84852,False,4128,False,Charmin,False,True,en,Enjoy the go.,False,Charmin,15293,False,False
190,1300408186843918337,2020-08-31 12:20:46,"@ballplayerbuzz Baseball, it's not just America's game, our Bears love it, too!  ??",1299503699564400643,ballplayerbuzz,1299503699564400643,1663914907,1663914907,1,1,Sprinklr,,"{'hashtags': [], 'symbols': [], 'user_mentions': [{'screen_name': 'ballplayerbuzz', 'name': 'Ballplayer Buzz', 'id': 1663914907, 'id_str': '1663914907', 'indices': [0, 15]}], 'urls': []}",84852,False,4128,False,Charmin,False,True,en,Enjoy the go.,False,Charmin,15293,False,False
191,1300404377518305281,2020-08-31 12:05:38,"@vinnytheterp Every roll of Charmin should deliver the strength and softness you expect, Vinny, so what you're saying is never what we expect.  Do us a favor and roll us a DM with more info so we can get to the bottom of your concern!",1299424183143804937,vinnytheterp,1299424183143804937,29341161,29341161,0,0,Sprinklr,,"{'hashtags': [], 'symbols': [], 'user_mentions': [{'screen_name': 'vinnytheterp', 'name': 'Vinny the Terp', 'id': 29341161, 'id_str': '29341161', 'indices': [0, 13]}], 'urls': []}",84852,False,4128,False,Charmin,False,True,en,Enjoy the go.,False,Charmin,15293,False,False
192,1300403010087124992,2020-08-31 12:00:12,"@ChrisVZ_23 Huh...isn't that a thought! ?? Two sided toilet paper...it would bring that, ""Do you hang the toilet paper over/under argument"" to a totally new level! ??",1299362956476583936,ChrisVZ_23,1299362956476583936,2690826409,2690826409,1,0,Sprinklr,,"{'hashtags': [], 'symbols': [], 'user_mentions': [{'screen_name': 'ChrisVZ_23', 'name': 'Chris V', 'id': 2690826409, 'id_str': '2690826409', 'indices': [0, 11]}], 'urls': []}",84852,False,4128,False,Charmin,False,True,en,Enjoy the go.,False,Charmin,15293,False,False
193,1299325070175866883,2020-08-28 12:36:51,"@frijjjj @frijjj Only the best Charmin should leave our factories, and we're bummed this one wasn't stopped before it left the building.  We'd like to know more about this pack, so we can learn how this roll snuck out.  Please roll us a DM soon so we can give you the help you deserve!",1299181473220747264,frijjjj,1299181473220747264,873897188,873897188,0,0,Sprinklr,,"{'hashtags': [], 'symbols': [], 'user_mentions': [{'screen_name': 'frijjjj', 'name': 'Frijjj', 'id': 873897188, 'id_str': '873897188', 'indices': [0, 8]}, {'screen_name': 'Frijjj', 'name': 'Emily Day', 'id': 340312632, 'id_str': '340312632', 'indices': [9, 16]}], 'urls': []}",84852,False,4128,False,Charmin,False,True,en,Enjoy the go.,False,Charmin,15293,False,False
194,1299321101231808516,2020-08-28 12:21:05,@eSpresso7200 Sounds like someone needs to make a doctor's appointment...and drink more water! ??,1299153627404148736,eSpresso7200,1299153627404148736,1263363076310499328,1263363076310499328,8,0,Sprinklr,,"{'hashtags': [], 'symbols': [], 'user_mentions': [{'screen_name': 'eSpresso7200', 'name': 'eSpresso', 'id': 1263363076310499328, 'id_str': '1263363076310499328', 'indices': [0, 13]}], 'urls': []}",84852,False,4128,False,Charmin,False,True,en,Enjoy the go.,False,Charmin,15293,False,False
195,1299318564109922306,2020-08-28 12:11:00,"@tweetmuhammed We think so, too!  ?? Thanks for sharing the love! ??",1299188912284459008,tweetmuhammed,1299188912284459008,1498854739,1498854739,1,0,Sprinklr,,"{'hashtags': [], 'symbols': [], 'user_mentions': [{'screen_name': 'tweetmuhammed', 'name': 'Genghis Khan', 'id': 1498854739, 'id_str': '1498854739', 'indices': [0, 14]}], 'urls': []}",84852,False,4128,False,Charmin,False,True,en,Enjoy the go.,False,Charmin,15293,False,False
196,1299318026983092224,2020-08-28 12:08:52,"@Kato_Kaelin *sniff, sniff*  Oh, there's so BEAUTIFUL!!  Congrats! ??",1299081875185520640,Kato_Kaelin,1299081875185520640,582050750,582050750,1,0,Sprinklr,,"{'hashtags': [], 'symbols': [], 'user_mentions': [{'screen_name': 'Kato_Kaelin', 'name': 'Kato Kaelin', 'id': 582050750, 'id_str': '582050750', 'indices': [0, 12]}], 'urls': []}",84852,False,4128,False,Charmin,False,True,en,Enjoy the go.,False,Charmin,15293,False,False
197,1298976649598447616,2020-08-27 13:32:21,"@GettinBusyLivin We'd be beary happy to! None of us should have to choose between using the products we enjoy today &amp; what we all need to preserve for our tomorrow. That's why we're made of material from well-managed, FSC-certified forests. To learn more roll over to: https://t.co/hezdztT5Bx",1298810022902652929,GettinBusyLivin,1298810022902652929,274705157,274705157,1,0,Sprinklr,,"{'hashtags': [], 'symbols': [], 'user_mentions': [{'screen_name': 'GettinBusyLivin', 'name': 'Shannon Marie', 'id': 274705157, 'id_str': '274705157', 'indices': [0, 16]}], 'urls': [{'url': 'https://t.co/hezdztT5Bx', 'expanded_url': 'http://spr.ly/6012GoMuw', 'display_url': 'spr.ly/6012GoMuw', 'indices': [273, 296]}]}",84852,False,4128,False,Charmin,False,True,en,Enjoy the go.,False,Charmin,15293,False,False
198,1298970998075781126,2020-08-27 13:09:54,"@lerikahahn24 We sincerely apologize, Lerika. We have strict quality controls in place to ensure only our best rolls out, and this shortie isn't cutting it. Somehow it squeezed past, and we'd be more than happy to help and make this right. Could you kindly send us a quick DM?",1298713358493863942,lerikahahn24,1298713358493863942,65799214,65799214,0,0,Sprinklr,,"{'hashtags': [], 'symbols': [], 'user_mentions': [{'screen_name': 'lerikahahn24', 'name': 'lerika', 'id': 65799214, 'id_str': '65799214', 'indices': [0, 13]}], 'urls': []}",84852,False,4128,False,Charmin,False,True,en,Enjoy the go.,False,Charmin,15293,False,False
199,1298648008695971840,2020-08-26 15:46:27,"@kayler_kitkat Too old for this, but here you go: #redteam",1298639025104986112,_0nly_Angel_,1298639025104986112,1251165404321505280,1251165404321505280,39,16,Twitter for iPhone,,"{'hashtags': [{'text': 'redteam', 'indices': [50, 58]}], 'symbols': [], 'user_mentions': [], 'urls': []}",84852,False,4128,False,Charmin,False,True,en,Enjoy the go.,False,Charmin,15293,False,False
200,1298611407483817985,2020-08-26 13:21:01,"@xoxo___savvy Butt, have you tired our Ultra Gentle? It's not only soft, but has a touch of soothing lotion on every sheet to help you when you're on the seat. ?? ?? ??",1298610055600889863,xoxo___savvy,1298610055600889863,1296117670065119232,1296117670065119232,1,0,Sprinklr,,"{'hashtags': [], 'symbols': [], 'user_mentions': [{'screen_name': 'xoxo___savvy', 'name': 'you can just call me sav', 'id': 1296117670065119232, 'id_str': '1296117670065119232', 'indices': [0, 13]}], 'urls': []}",84852,False,4128,False,Charmin,False,True,en,Enjoy the go.,False,Charmin,15293,False,False
201,1298609722971619328,2020-08-26 13:14:19,"@xoxo___savvy Thanks for the shout out! Tag or not, we're happy to roll with you.  ??",1298469860435996673,xoxo___savvy,1298469860435996673,1296117670065119232,1296117670065119232,1,0,Sprinklr,,"{'hashtags': [], 'symbols': [], 'user_mentions': [{'screen_name': 'xoxo___savvy', 'name': 'you can just call me sav', 'id': 1296117670065119232, 'id_str': '1296117670065119232', 'indices': [0, 13]}], 'urls': []}",84852,False,4128,False,Charmin,False,True,en,Enjoy the go.,False,Charmin,15293,False,False
202,1298605977428791297,2020-08-26 12:59:26,"@BoxensDonutShop You and your booty deserve the best! Whether it's Ultra Strong or Ultra Gentle, enjoying the go with Charmin is sure please... just don't give us that squeeze. ?? ??",1298356460254932992,MrBoxen,1298356460254932992,3394686376,3394686376,0,0,Sprinklr,,"{'hashtags': [], 'symbols': [], 'user_mentions': [], 'urls': []}",84852,False,4128,False,Charmin,False,True,en,Enjoy the go.,False,Charmin,15293,False,False
203,1298245524584357890,2020-08-25 13:07:07,"@DCourtney31717 The last thing we'd want to do is disappoint you, and we're sorry to hear that's been the case. We'd be more than happy to see how we can help and learn more. Could you send us a quick DM and share more with us about your experience?",1298164292672344064,DCourtney31717,1298164292672344064,719821964987138048,719821964987138048,0,0,Sprinklr,,"{'hashtags': [], 'symbols': [], 'user_mentions': [{'screen_name': 'DCourtney31717', 'name': 'BombShellDanielle', 'id': 719821964987138048, 'id_str': '719821964987138048', 'indices': [0, 15]}], 'urls': []}",84852,False,4128,False,Charmin,False,True,en,Enjoy the go.,False,Charmin,15293,False,False
204,1298240802876010496,2020-08-25 12:48:22,@SandyWhitman4 ?? ??,1298054489363156997,SandyWhitman4,1298054489363156997,3254799992,3254799992,0,0,Sprinklr,,"{'hashtags': [], 'symbols': [], 'user_mentions': [{'screen_name': 'SandyWhitman4', 'name': 'Sandy Whitman', 'id': 3254799992, 'id_str': '3254799992', 'indices': [0, 14]}], 'urls': []}",84852,False,4128,False,Charmin,False,True,und,Enjoy the go.,False,Charmin,15293,False,False
205,1298239735790477312,2020-08-25 12:44:07,@charmer_mi @bounty ful ??,1298044970054680577,charmer_mi,1298044970054680577,4760874563,4760874563,1,0,Sprinklr,,"{'hashtags': [], 'symbols': [], 'user_mentions': [{'screen_name': 'charmer_mi', 'name': 'Charmer', 'id': 4760874563, 'id_str': '4760874563', 'indices': [0, 11]}, {'screen_name': 'Bounty', 'name': 'Bounty', 'id': 301992337, 'id_str': '301992337', 'indices': [12, 19]}], 'urls': []}",84852,False,4128,False,Charmin,False,True,und,Enjoy the go.,False,Charmin,15293,False,False
206,1298230215337009153,2020-08-25 12:06:17,@GettinBusyLivin ?? ??,1297985342260178944,GettinBusyLivin,1297985342260178944,274705157,274705157,0,0,Sprinklr,,"{'hashtags': [], 'symbols': [], 'user_mentions': [{'screen_name': 'GettinBusyLivin', 'name': 'Shannon Marie', 'id': 274705157, 'id_str': '274705157', 'indices': [0, 16]}], 'urls': []}",84852,False,4128,False,Charmin,False,True,und,Enjoy the go.,False,Charmin,15293,False,False
207,1298230215337009153,2020-08-25 12:06:17,@GettinBusyLivin ?? ??,1297985342260178944,GettinBusyLivin,1297985342260178944,274705157,274705157,0,0,Sprinklr,,"{'hashtags': [], 'symbols': [], 'user_mentions': [{'screen_name': 'GettinBusyLivin', 'name': 'Shannon Marie', 'id': 274705157, 'id_str': '274705157', 'indices': [0, 16]}], 'urls': []}",84852,False,4128,False,Charmin,False,True,und,Enjoy the go.,False,Charmin,15293,False,False
208,1298230102367535110,2020-08-25 12:05:51,@GettinBusyLivin You're beary welcome! We're happy we could help. ??,1297983937856192512,GettinBusyLivin,1297983937856192512,274705157,274705157,0,0,Sprinklr,,"{'hashtags': [], 'symbols': [], 'user_mentions': [{'screen_name': 'GettinBusyLivin', 'name': 'Shannon Marie', 'id': 274705157, 'id_str': '274705157', 'indices': [0, 16]}], 'urls': []}",84852,False,4128,False,Charmin,False,True,en,Enjoy the go.,False,Charmin,15293,False,False
209,1297912138032394242,2020-08-24 15:02:22,"@GettinBusyLivin And lastly, it is our goal to use 100% recycled fiber in our fiber based packaging by 2025. https://t.co/31i4H820qD If you have any further questions, please feel free to DM us anytime! (4)",1297546971406675969,GettinBusyLivin,1297546971406675969,274705157,274705157,1,0,Sprinklr,,"{'hashtags': [], 'symbols': [], 'user_mentions': [{'screen_name': 'GettinBusyLivin', 'name': 'Shannon Marie', 'id': 274705157, 'id_str': '274705157', 'indices': [0, 16]}], 'urls': [{'url': 'https://t.co/31i4H820qD', 'expanded_url': 'http://spr.ly/6011GWHSd', 'display_url': 'spr.ly/6011GWHSd', 'indices': [109, 132]}]}",84852,False,4128,False,Charmin,False,True,en,Enjoy the go.,False,Charmin,15293,False,False
