id_no,tweet_id,tweet_created_at,tweet_text,in_reply to status_id,in_reply_to_screen_name,in_reply_to_status_id_str,in_reply_to_user_id,in_reply_to_user_id_str,favorite_count,retweet_count,source,user_location,entities,followers_count,foliowing,friends_count,follow_request_sent,user_name,user_protected,user-verified,lang,user_description,geo_enabled,user_screen_name,user_statuses_count,tweet_truncated,tweet_is_quote_status
1,1311349765808910336,2020-09-30 16:58:42,"Big thanks to @MIT's Dr. Kerri Cahoy, @ASU's Dr. Craig Hardgrove, @SwRI's Dr. Scot Rafkin, and @NASA's Florence Tan for participating, as well as our own launch services manager Shandy Asturias for moderating this insightful chat. ??",1311349492591898625,VirginOrbit,1311349492591898625,804794734472331264,804794734472331264,26,4,Twitter Web App,"Long Beach, CA","{'hashtags': [], 'symbols': [], 'user_mentions': [{'screen_name': 'MIT', 'name': 'Massachusetts Institute of Technology (MIT)', 'id': 15460048, 'id_str': '15460048', 'indices': [14, 18]}, {'screen_name': 'ASU', 'name': 'Arizona State University', 'id': 18783501, 'id_str': '18783501', 'indices': [38, 42]}, {'screen_name': 'SwRI', 'name': 'Southwest Research Institute', 'id': 25301238, 'id_str': '25301238', 'indices': [66, 71]}, {'screen_name': 'NASA', 'name': 'NASA', 'id': 11348282, 'id_str': '11348282', 'indices': [95, 100]}], 'urls': []}",69478,False,118,False,Virgin Orbit,False,True,en,Opening space for good by launching satellites from the wing of a 747. No biggie. Founded by @RichardBranson. Proud member of the @Virgin family.,True,VirginOrbit,1313,False,False
2,1311349492591898625,2020-09-30 16:57:37,"Creative smallsat applications are unlocking a brighter future for research, science, deep space exploration, and more! Hear from leading experts on where smallsats are headed next in this @AIAA #ASCENDxSummit panel, ""Big Science with Small Satellites."" https://t.co/udlZkD2lFj",None,None,None,None,None,47,12,Twitter Web App,"Long Beach, CA","{'hashtags': [{'text': 'ASCENDxSummit', 'indices': [195, 209]}], 'symbols': [], 'user_mentions': [{'screen_name': 'aiaa', 'name': 'AIAA', 'id': 44369634, 'id_str': '44369634', 'indices': [189, 194]}], 'urls': [{'url': 'https://t.co/udlZkD2lFj', 'expanded_url': 'https://youtu.be/D_pw_yiNrY0', 'display_url': 'youtu.be/D_pw_yiNrY0', 'indices': [254, 277]}]}",69478,False,118,False,Virgin Orbit,False,True,en,Opening space for good by launching satellites from the wing of a 747. No biggie. Founded by @RichardBranson. Proud member of the @Virgin family.,True,VirginOrbit,1313,False,False
3,1310656802963427328,2020-09-28 19:05:07,"(And yes, this panel will be available to view shortly after the conference concludes, just in case the time zones don't quite line up for you!)",1310656640736088064,VirginOrbit,1310656640736088064,804794734472331264,804794734472331264,20,0,Twitter for iPhone,"Long Beach, CA","{'hashtags': [], 'symbols': [], 'user_mentions': [], 'urls': []}",69478,False,118,False,Virgin Orbit,False,True,en,Opening space for good by launching satellites from the wing of a 747. No biggie. Founded by @RichardBranson. Proud member of the @Virgin family.,True,VirginOrbit,1313,False,False
4,1310656640736088064,2020-09-28 19:04:28,.@AerospaceSummit has put together an amazing virtual conference this year! Registration is free — so come join our very own @Pomerantz for a talk on where advanced manufacturing technology is headed next in aerospace. https://t.co/JSg5QztQt5 https://t.co/yg702XbEJn,None,None,None,None,None,48,8,Twitter for iPhone,"Long Beach, CA","{'hashtags': [], 'symbols': [], 'user_mentions': [{'screen_name': 'AerospaceSummit', 'name': 'Global Aerospace', 'id': 140516005, 'id_str': '140516005', 'indices': [1, 17]}, {'screen_name': 'Pomerantz', 'name': 'William Pomerantz', 'id': 14217740, 'id_str': '14217740', 'indices': [125, 135]}], 'urls': [{'url': 'https://t.co/JSg5QztQt5', 'expanded_url': 'http://bit.ly/aerospacesummit', 'display_url': 'bit.ly/aerospacesummit', 'indices': [219, 242]}], 'media': [{'id': 1310656636998971392, 'id_str': '1310656636998971392', 'indices': [243, 266], 'media_url': 'http://pbs.twimg.com/media/EjBjRGbU8AAPfPK.jpg', 'media_url_https': 'https://pbs.twimg.com/media/EjBjRGbU8AAPfPK.jpg', 'url': 'https://t.co/yg702XbEJn', 'display_url': 'pic.twitter.com/yg702XbEJn', 'expanded_url': 'https://twitter.com/Virgin_Orbit/status/1310656640736088064/photo/1', 'type': 'photo', 'sizes': {'thumb': {'w': 150, 'h': 150, 'resize': 'crop'}, 'medium': {'w': 1200, 'h': 600, 'resize': 'fit'}, 'small': {'w': 680, 'h': 340, 'resize': 'fit'}, 'large': {'w': 2048, 'h': 1024, 'resize': 'fit'}}}]}",69478,False,118,False,Virgin Orbit,False,True,en,Opening space for good by launching satellites from the wing of a 747. No biggie. Founded by @RichardBranson. Proud member of the @Virgin family.,True,VirginOrbit,1313,False,False
5,1310656640736088064,2020-09-28 19:04:28,.@AerospaceSummit has put together an amazing virtual conference this year! Registration is free — so come join our very own @Pomerantz for a talk on where advanced manufacturing technology is headed next in aerospace. https://t.co/JSg5QztQt5 https://t.co/yg702XbEJn,None,None,None,None,None,48,8,Twitter for iPhone,"Long Beach, CA","{'hashtags': [], 'symbols': [], 'user_mentions': [{'screen_name': 'AerospaceSummit', 'name': 'Global Aerospace', 'id': 140516005, 'id_str': '140516005', 'indices': [1, 17]}, {'screen_name': 'Pomerantz', 'name': 'William Pomerantz', 'id': 14217740, 'id_str': '14217740', 'indices': [125, 135]}], 'urls': [{'url': 'https://t.co/JSg5QztQt5', 'expanded_url': 'http://bit.ly/aerospacesummit', 'display_url': 'bit.ly/aerospacesummit', 'indices': [219, 242]}], 'media': [{'id': 1310656636998971392, 'id_str': '1310656636998971392', 'indices': [243, 266], 'media_url': 'http://pbs.twimg.com/media/EjBjRGbU8AAPfPK.jpg', 'media_url_https': 'https://pbs.twimg.com/media/EjBjRGbU8AAPfPK.jpg', 'url': 'https://t.co/yg702XbEJn', 'display_url': 'pic.twitter.com/yg702XbEJn', 'expanded_url': 'https://twitter.com/Virgin_Orbit/status/1310656640736088064/photo/1', 'type': 'photo', 'sizes': {'thumb': {'w': 150, 'h': 150, 'resize': 'crop'}, 'medium': {'w': 1200, 'h': 600, 'resize': 'fit'}, 'small': {'w': 680, 'h': 340, 'resize': 'fit'}, 'large': {'w': 2048, 'h': 1024, 'resize': 'fit'}}}]}",69478,False,118,False,Virgin Orbit,False,True,en,Opening space for good by launching satellites from the wing of a 747. No biggie. Founded by @RichardBranson. Proud member of the @Virgin family.,True,VirginOrbit,1313,False,False
6,1309541926031339520,2020-09-25 17:14:59,"RT @cweeden: ""If I go to a park and see a plastic bottle, I'll pick it up"" @nobuokada 

Hey space community, would you do the same? What et…",None,None,None,None,None,0,14,Twitter Web App,"Long Beach, CA","{'hashtags': [], 'symbols': [], 'user_mentions': [{'screen_name': 'cweeden', 'name': 'Charity Weeden, MSc', 'id': 15248074, 'id_str': '15248074', 'indices': [3, 11]}, {'screen_name': 'nobuokada', 'name': 'Nobu Okada', 'id': 40483291, 'id_str': '40483291', 'indices': [75, 85]}], 'urls': []}",69478,False,118,False,Virgin Orbit,False,True,en,Opening space for good by launching satellites from the wing of a 747. No biggie. Founded by @RichardBranson. Proud member of the @Virgin family.,True,VirginOrbit,1313,False,True
7,1308086384901500932,2020-09-21 16:51:11,"#ICYMI: Applications for 2021 paid summer internships at @Virgin_Orbit are now open! Aspiring engineer? Legal maverick? Financial wiz? We've got room for all kinds of talent on our team.

Check out the open positions on our website: https://t.co/VzgB5J9KTe https://t.co/HoT2a1jTLN",None,None,None,None,None,141,31,Twitter Web App,"Long Beach, CA","{'hashtags': [{'text': 'ICYMI', 'indices': [0, 6]}], 'symbols': [], 'user_mentions': [{'screen_name': 'Virgin_Orbit', 'name': 'Virgin Orbit', 'id': 1352663541396852736, 'id_str': '1352663541396852736', 'indices': [57, 70]}], 'urls': [{'url': 'https://t.co/VzgB5J9KTe', 'expanded_url': 'https://virg.in/3Ef', 'display_url': 'virg.in/3Ef', 'indices': [233, 256]}], 'media': [{'id': 1308086339686903821, 'id_str': '1308086339686903821', 'indices': [257, 280], 'media_url': 'http://pbs.twimg.com/media/EidBmGyUMA0tqYC.jpg', 'media_url_https': 'https://pbs.twimg.com/media/EidBmGyUMA0tqYC.jpg', 'url': 'https://t.co/HoT2a1jTLN', 'display_url': 'pic.twitter.com/HoT2a1jTLN', 'expanded_url': 'https://twitter.com/Virgin_Orbit/status/1308086384901500932/photo/1', 'type': 'photo', 'sizes': {'small': {'w': 680, 'h': 425, 'resize': 'fit'}, 'thumb': {'w': 150, 'h': 150, 'resize': 'crop'}, 'medium': {'w': 1200, 'h': 750, 'resize': 'fit'}, 'large': {'w': 2048, 'h': 1280, 'resize': 'fit'}}}]}",69478,False,118,False,Virgin Orbit,False,True,en,Opening space for good by launching satellites from the wing of a 747. No biggie. Founded by @RichardBranson. Proud member of the @Virgin family.,True,VirginOrbit,1313,False,False
8,1305929579341606912,2020-09-15 18:00:49,"RT @mattfellowship: Tonight at 5pm PT/8pm ET! Hear from @SirishaBandla (#MattFellowship Team Member, @PurdueAeroAstro grad, and @Virgin_Orb…",None,None,None,None,None,0,8,Twitter Web App,"Long Beach, CA","{'hashtags': [{'text': 'MattFellowship', 'indices': [72, 87]}], 'symbols': [], 'user_mentions': [{'screen_name': 'mattfellowship', 'name': 'Matthew Isakowitz Fellowship', 'id': 892615003110608896, 'id_str': '892615003110608896', 'indices': [3, 18]}, {'screen_name': 'SirishaBandla', 'name': 'Sirisha Bandla', 'id': 525579309, 'id_str': '525579309', 'indices': [56, 70]}, {'screen_name': 'PurdueAeroAstro', 'name': 'PurdueAeroAstro', 'id': 4805599703, 'id_str': '4805599703', 'indices': [101, 117]}], 'urls': []}",69478,False,118,False,Virgin Orbit,False,True,en,Opening space for good by launching satellites from the wing of a 747. No biggie. Founded by @RichardBranson. Proud member of the @Virgin family.,True,VirginOrbit,1313,False,False
9,1305582600300277760,2020-09-14 19:02:03,"We're so grateful to the folks at the Bridge Ventilator Consortium, whose expert guidance enabled us to produce more than 600 bridge ventilators in response to the COVID-19 pandemic. 

BVC's new website just went live — check it out &amp; consider donating: https://t.co/oyV9l8XpID https://t.co/YNhVVmbn8b",None,None,None,None,None,87,17,Twitter Web App,"Long Beach, CA","{'hashtags': [], 'symbols': [], 'user_mentions': [], 'urls': [{'url': 'https://t.co/oyV9l8XpID', 'expanded_url': 'http://bridgevc.org', 'display_url': 'bridgevc.org', 'indices': [258, 281]}], 'media': [{'id': 1305582552925614080, 'id_str': '1305582552925614080', 'indices': [282, 305], 'media_url': 'http://pbs.twimg.com/media/Eh5caiQUMAAQtRz.jpg', 'media_url_https': 'https://pbs.twimg.com/media/Eh5caiQUMAAQtRz.jpg', 'url': 'https://t.co/YNhVVmbn8b', 'display_url': 'pic.twitter.com/YNhVVmbn8b', 'expanded_url': 'https://twitter.com/Virgin_Orbit/status/1305582600300277760/photo/1', 'type': 'photo', 'sizes': {'thumb': {'w': 150, 'h': 150, 'resize': 'crop'}, 'small': {'w': 680, 'h': 453, 'resize': 'fit'}, 'large': {'w': 2048, 'h': 1366, 'resize': 'fit'}, 'medium': {'w': 1200, 'h': 800, 'resize': 'fit'}}}]}",69478,False,118,False,Virgin Orbit,False,True,en,Opening space for good by launching satellites from the wing of a 747. No biggie. Founded by @RichardBranson. Proud member of the @Virgin family.,True,VirginOrbit,1313,False,False
10,1304201727839580161,2020-09-10 23:34:57,RT @mandy_vaughn: Thanks for the support @Virgin_Orbit !! Awesome to Cosmic Girl in the air to support @TheRealVOXSpace https://t.co/rE8Eil…,None,None,None,None,None,0,4,TweetDeck,"Long Beach, CA","{'hashtags': [], 'symbols': [], 'user_mentions': [{'screen_name': 'mandy_vaughn', 'name': 'Mandy Vaughn', 'id': 838200571, 'id_str': '838200571', 'indices': [3, 16]}, {'screen_name': 'Virgin_Orbit', 'name': 'Virgin Orbit', 'id': 804794734472331264, 'id_str': '804794734472331264', 'indices': [41, 54]}, {'screen_name': 'TheRealVOXSpace', 'name': 'VOX Space', 'id': 879507995985551360, 'id_str': '879507995985551360', 'indices': [103, 119]}], 'urls': []}",69478,False,118,False,Virgin Orbit,False,True,en,Opening space for good by launching satellites from the wing of a 747. No biggie. Founded by @RichardBranson. Proud member of the @Virgin family.,True,VirginOrbit,1313,False,True
11,1304152289913917440,2020-09-10 20:18:30,More info on ABMS and the purpose of the field test here ? https://t.co/MaqMv6rFw9,1304110677192187929,VirginOrbit,1304110677192187929,804794734472331264,804794734472331264,23,3,Twitter Web App,"Long Beach, CA","{'hashtags': [], 'symbols': [], 'user_mentions': [], 'urls': [{'url': 'https://t.co/MaqMv6rFw9', 'expanded_url': 'https://twitter.com/usairforce/status/1301678886070222850', 'display_url': 'twitter.com/usairforce/sta…', 'indices': [59, 82]}]}",69478,False,118,False,Virgin Orbit,False,True,en,Opening space for good by launching satellites from the wing of a 747. No biggie. Founded by @RichardBranson. Proud member of the @Virgin family.,True,VirginOrbit,1313,False,True
12,1304110677192187929,2020-09-10 17:33:09,Cosmic Girl took off from Mojave last week after @usairforce tapped our friends @TheRealVOXSpace to conduct a responsive launch sim. This exercise was part of a broader on-ramp for the Advanced Battle Management System (ABMS) ? https://t.co/DwLovkIHC3,None,None,None,None,None,130,22,Twitter Web App,"Long Beach, CA","{'hashtags': [], 'symbols': [], 'user_mentions': [{'screen_name': 'usairforce', 'name': 'U.S. Air Force', 'id': 19611483, 'id_str': '19611483', 'indices': [49, 60]}, {'screen_name': 'TheRealVOXSpace', 'name': 'VOX Space', 'id': 879507995985551360, 'id_str': '879507995985551360', 'indices': [80, 96]}], 'urls': [{'url': 'https://t.co/DwLovkIHC3', 'expanded_url': 'https://virg.in/WKu', 'display_url': 'virg.in/WKu', 'indices': [228, 251]}]}",69478,False,118,False,Virgin Orbit,False,True,en,Opening space for good by launching satellites from the wing of a 747. No biggie. Founded by @RichardBranson. Proud member of the @Virgin family.,True,VirginOrbit,1313,False,False
13,1303376609865424897,2020-09-08 16:56:14,"As an added bonus, we've also been able to reduce our random vibration loads, guaranteeing a smoother ride to orbit for our customers. Check out the new numbers at our home on the web! https://t.co/DE7R9C269h https://t.co/aLVF73G4jL",1303376324648550400,VirginOrbit,1303376324648550400,804794734472331264,804794734472331264,62,17,Twitter Web App,"Long Beach, CA","{'hashtags': [], 'symbols': [], 'user_mentions': [], 'urls': [{'url': 'https://t.co/DE7R9C269h', 'expanded_url': 'https://virg.in/x2h', 'display_url': 'virg.in/x2h', 'indices': [185, 208]}], 'media': [{'id': 1303376595294408710, 'id_str': '1303376595294408710', 'indices': [209, 232], 'media_url': 'http://pbs.twimg.com/media/EhaGG5sU0AYFQ9J.jpg', 'media_url_https': 'https://pbs.twimg.com/media/EhaGG5sU0AYFQ9J.jpg', 'url': 'https://t.co/aLVF73G4jL', 'display_url': 'pic.twitter.com/aLVF73G4jL', 'expanded_url': 'https://twitter.com/Virgin_Orbit/status/1303376609865424897/photo/1', 'type': 'photo', 'sizes': {'thumb': {'w': 150, 'h': 150, 'resize': 'crop'}, 'small': {'w': 680, 'h': 453, 'resize': 'fit'}, 'medium': {'w': 1200, 'h': 800, 'resize': 'fit'}, 'large': {'w': 2048, 'h': 1366, 'resize': 'fit'}}}]}",69478,False,118,False,Virgin Orbit,False,True,en,Opening space for good by launching satellites from the wing of a 747. No biggie. Founded by @RichardBranson. Proud member of the @Virgin family.,True,VirginOrbit,1313,False,False
14,1303376324648550400,2020-09-08 16:55:06,"In our latest Service Guide update, we've added lots of helpful info to better guide your mission planning, including new milestones for customer deliverables and more details around the acceptance testing needed to fly on LauncherOne.",1303376241169317888,VirginOrbit,1303376241169317888,804794734472331264,804794734472331264,55,8,Twitter Web App,"Long Beach, CA","{'hashtags': [], 'symbols': [], 'user_mentions': [], 'urls': []}",69478,False,118,False,Virgin Orbit,False,True,en,Opening space for good by launching satellites from the wing of a 747. No biggie. Founded by @RichardBranson. Proud member of the @Virgin family.,True,VirginOrbit,1313,False,False
15,1303376241169317888,2020-09-08 16:54:46,"To all the small satellite makers and operators out there in the world, we wanted to give you a heads up that booking a mission on LauncherOne just got a whole lot easier! https://t.co/yh1HdqkHog",None,None,None,None,None,165,28,Twitter Web App,"Long Beach, CA","{'hashtags': [], 'symbols': [], 'user_mentions': [], 'urls': [{'url': 'https://t.co/yh1HdqkHog', 'expanded_url': 'https://virginorbit.com/our-2020-service-guide-a-smoother-path-to-orbit/', 'display_url': 'virginorbit.com/our-2020-servi…', 'indices': [172, 195]}]}",69478,False,118,False,Virgin Orbit,False,True,en,Opening space for good by launching satellites from the wing of a 747. No biggie. Founded by @RichardBranson. Proud member of the @Virgin family.,True,VirginOrbit,1313,False,False
16,1303150393359101955,2020-09-08 01:57:19,@SciGuySpace @spacecom Our air-launch system is revolutionary and unlocks brand new markets (both by geography and by mission type). And it's *still* one of the cheapest launch development programs in history.,1303150275465625600,VirginOrbit,1303150275465625600,804794734472331264,804794734472331264,77,9,TweetDeck,"Long Beach, CA","{'hashtags': [], 'symbols': [], 'user_mentions': [{'screen_name': 'SciGuySpace', 'name': 'Eric Berger', 'id': 15726728, 'id_str': '15726728', 'indices': [0, 12]}, {'screen_name': 'spacecom', 'name': 'Parabolicarc.com', 'id': 18928764, 'id_str': '18928764', 'indices': [13, 22]}], 'urls': []}",69478,False,118,False,Virgin Orbit,False,True,en,Opening space for good by launching satellites from the wing of a 747. No biggie. Founded by @RichardBranson. Proud member of the @Virgin family.,True,VirginOrbit,1313,False,False
17,1303150275465625600,2020-09-08 01:56:51,"@SciGuySpace @spacecom We've also already developed a new high-rate rocket production line and a 747 derivative aircraft.
 
History, including recent history, has shown that building out production capabilities and setting up multiple launch sites are bigger $$ projects than initial rocket development.",1303150166199791616,VirginOrbit,1303150166199791616,804794734472331264,804794734472331264,84,8,TweetDeck,"Long Beach, CA","{'hashtags': [], 'symbols': [], 'user_mentions': [{'screen_name': 'SciGuySpace', 'name': 'Eric Berger', 'id': 15726728, 'id_str': '15726728', 'indices': [0, 12]}, {'screen_name': 'spacecom', 'name': 'Parabolicarc.com', 'id': 18928764, 'id_str': '18928764', 'indices': [13, 22]}], 'urls': []}",69478,False,118,False,Virgin Orbit,False,True,en,Opening space for good by launching satellites from the wing of a 747. No biggie. Founded by @RichardBranson. Proud member of the @Virgin family.,True,VirginOrbit,1313,False,False
18,1303150166199791616,2020-09-08 01:56:25,"@SciGuySpace @spacecom We don't comment on investment numbers, but a few thoughts.
 
We’ve done a ton as a very small aerospace company. We’re not developing a traditional small ground-lit rocket—we’re doing something much more and bringing a new capability.",1302629942254096384,SciGuySpace,1302629942254096384,15726728,15726728,64,7,TweetDeck,"Long Beach, CA","{'hashtags': [], 'symbols': [], 'user_mentions': [{'screen_name': 'SciGuySpace', 'name': 'Eric Berger', 'id': 15726728, 'id_str': '15726728', 'indices': [0, 12]}, {'screen_name': 'spacecom', 'name': 'Parabolicarc.com', 'id': 18928764, 'id_str': '18928764', 'indices': [13, 22]}], 'urls': []}",69478,False,118,False,Virgin Orbit,False,True,en,Opening space for good by launching satellites from the wing of a 747. No biggie. Founded by @RichardBranson. Proud member of the @Virgin family.,True,VirginOrbit,1313,False,False
19,1302260503821955073,2020-09-05 15:01:13,"@drryljoh2018 Towards the end of this year! You can read more here:

https://t.co/Uc8Zd8XnBs",1302259827909955585,drryljoh2018,1302259827909955585,3267689659,3267689659,1,0,TweetDeck,"Long Beach, CA","{'hashtags': [], 'symbols': [], 'user_mentions': [{'screen_name': 'drryljoh2018', 'name': 'DARRYL JOHNSON', 'id': 3267689659, 'id_str': '3267689659', 'indices': [0, 13]}], 'urls': [{'url': 'https://t.co/Uc8Zd8XnBs', 'expanded_url': 'https://virginorbit.com/wrapping-up-our-first-launch-demo-and-looking-ahead-to-launch-demo-2/', 'display_url': 'virginorbit.com/wrapping-up-ou…', 'indices': [69, 92]}]}",69478,False,118,False,Virgin Orbit,False,True,en,Opening space for good by launching satellites from the wing of a 747. No biggie. Founded by @RichardBranson. Proud member of the @Virgin family.,True,VirginOrbit,1313,False,False
20,1302256853510832128,2020-09-05 14:46:43,"@soxx_carlson You can always find all of our job openings at https://t.co/62PCk3kKYE. We often have positions for recent grads -- but list of what positions we are hiring for changes frequently. So if you don't see something that is a good fit now, check back often!",1302000533339766793,soxx_carlson,1302000533339766793,2838597444,2838597444,1,0,TweetDeck,"Long Beach, CA","{'hashtags': [], 'symbols': [], 'user_mentions': [{'screen_name': 'soxx_carlson', 'name': 'Young Short Richard', 'id': 2838597444, 'id_str': '2838597444', 'indices': [0, 13]}], 'urls': [{'url': 'https://t.co/62PCk3kKYE', 'expanded_url': 'https://virginorbit.com/careers/', 'display_url': 'virginorbit.com/careers/', 'indices': [61, 84]}]}",69478,False,118,False,Virgin Orbit,False,True,en,Opening space for good by launching satellites from the wing of a 747. No biggie. Founded by @RichardBranson. Proud member of the @Virgin family.,True,VirginOrbit,1313,False,False
21,1302256274671722502,2020-09-05 14:44:25,"@AviationShooter All of our internships are, and have always been, paid. And we provide housing for interns, too.",1302177680045924352,AsAswhy,1302177680045924352,1271914937703522307,1271914937703522307,1,0,TweetDeck,"Long Beach, CA","{'hashtags': [], 'symbols': [], 'user_mentions': [], 'urls': []}",69478,False,118,False,Virgin Orbit,False,True,en,Opening space for good by launching satellites from the wing of a 747. No biggie. Founded by @RichardBranson. Proud member of the @Virgin family.,True,VirginOrbit,1313,False,False
22,1301993777100398596,2020-09-04 21:21:20,@AndrewClarkeeee We hope so too! ???? Best of luck to you in the new school year.,1301991864946626562,AndrewClarkeeee,1301991864946626562,830975541071147008,830975541071147008,1,0,Twitter Web App,"Long Beach, CA","{'hashtags': [], 'symbols': [], 'user_mentions': [{'screen_name': 'AndrewClarkeeee', 'name': 'Andrew', 'id': 830975541071147008, 'id_str': '830975541071147008', 'indices': [0, 16]}], 'urls': []}",69478,False,118,False,Virgin Orbit,False,True,en,Opening space for good by launching satellites from the wing of a 747. No biggie. Founded by @RichardBranson. Proud member of the @Virgin family.,True,VirginOrbit,1313,False,False
23,1301991320177709056,2020-09-04 21:11:35,"@AndrewClarkeeee Although we appreciate the eagerness of younger students, our internships are geared toward college students currently pursuing a Bachelor's or Master's in a relevant major.",1301951598793424896,AndrewClarkeeee,1301951598793424896,830975541071147008,830975541071147008,1,0,Twitter Web App,"Long Beach, CA","{'hashtags': [], 'symbols': [], 'user_mentions': [{'screen_name': 'AndrewClarkeeee', 'name': 'Andrew', 'id': 830975541071147008, 'id_str': '830975541071147008', 'indices': [0, 16]}], 'urls': []}",69478,False,118,False,Virgin Orbit,False,True,en,Opening space for good by launching satellites from the wing of a 747. No biggie. Founded by @RichardBranson. Proud member of the @Virgin family.,True,VirginOrbit,1313,False,False
24,1301949246048927744,2020-09-04 18:24:23,"Not 100% sure if you're qualified? Apply anyway. Never worked in a space-related field before? Apply anyway! The application window closes on Friday, November 13th, so head on over to our Internship page right now to check out the open positions. Opportunity awaits!",1301949163471429634,VirginOrbit,1301949163471429634,804794734472331264,804794734472331264,63,14,Twitter Web App,"Long Beach, CA","{'hashtags': [], 'symbols': [], 'user_mentions': [], 'urls': []}",69478,False,118,False,Virgin Orbit,False,True,en,Opening space for good by launching satellites from the wing of a 747. No biggie. Founded by @RichardBranson. Proud member of the @Virgin family.,True,VirginOrbit,1313,False,False
25,1301949246048927744,2020-09-04 18:24:23,"Not 100% sure if you're qualified? Apply anyway. Never worked in a space-related field before? Apply anyway! The application window closes on Friday, November 13th, so head on over to our Internship page right now to check out the open positions. Opportunity awaits!",1301949163471429634,VirginOrbit,1301949163471429634,804794734472331264,804794734472331264,63,14,Twitter Web App,"Long Beach, CA","{'hashtags': [], 'symbols': [], 'user_mentions': [], 'urls': []}",69478,False,118,False,Virgin Orbit,False,True,en,Opening space for good by launching satellites from the wing of a 747. No biggie. Founded by @RichardBranson. Proud member of the @Virgin family.,True,VirginOrbit,1313,False,False
